Identifiant;Statut;Motif du refus;Domaine;Activité;Commune;Rue;Type d'ouvrage;Code ouvrage;Num. DI;Ordre de travail;Programme;Créé le;Entreprise;Date Intervention;Intervenant;Observation;Durée Intervention;obs_clean;remplacement_fusible;remplacement_ampoule;remplacement_driver;remplacement_boite_derivation;remplacement_driver_et_connexions;pose_lanterne_provisoire;separation_phases_cablage;plateau_led_hs;reenclenchement_disjoncteur;reprise_raccordement;refection_connexions;resume_ia
44909739;Validé;;Eclairage public;Tournée de nuit luminaire;QUIMPER;AVENUE LEON BLUM;Luminaire;E2928_1;;485.0;;21/01/2026;CITEOS QUIMPER;2026-01-21;;;;;non;non;non;non;non;non;non;non;non;non;non;aucune opération détectée
44909737;Validé;;Eclairage public;Tournée de nuit luminaire;QUIMPER;RUE FRANCOIS LE GUINER;Luminaire;E956_1;;485.0;;21/01/2026;CITEOS QUIMPER;2026-01-21;;;;;non;non;non;non;non;non;non;non;non;non;non;aucune opération détectée
44909735;Validé;;Eclairage public;Tournée de nuit luminaire;QUIMPER;RUE PARK BIHAN;Luminaire;E3092_1;;485.0;;21/01/2026;CITEOS QUIMPER;2026-01-21;;;;;non;non;non;non;non;non;non;non;non;non;non;aucune opération détectée
44909733;Validé;;Eclairage public;Tournée de nuit luminaire;QUIMPER;ROND POINT GUTENBERG;Luminaire;E2860_1;;485.0;;21/01/2026;CITEOS QUIMPER;2026-01-21;;;;;non;non;non;non;non;non;non;non;non;non;non;aucune opération détectée
44909731;Validé;;Eclairage public;Tournée de nuit luminaire;QUIMPER;BOULEVARD FLANDRES DUNKERQUE1940;Luminaire;E1116_1;;485.0;;21/01/2026;CITEOS QUIMPER;2026-01-21;;;;;non;non;non;non;non;non;non;non;non;non;non;aucune opération détectée
44909729;Validé;;Eclairage public;Tournée de nuit luminaire;QUIMPER;AVENUE DU MORBIHAN;Luminaire;E1108_1;;485.0;;21/01/2026;CITEOS QUIMPER;2026-01-21;;;;;non;non;non;non;non;non;non;non;non;non;non;aucune opération détectée
44909727;Validé;;Eclairage public;Tournée de nuit luminaire;QUIMPER;ROND POINT GUTENBERG;Luminaire;E1106_1;;485.0;;21/01/2026;CITEOS QUIMPER;2026-01-21;;;;;non;non;non;non;non;non;non;non;non;non;non;aucune opération détectée
44909725;Validé;;Eclairage public;Tournée de nuit luminaire;QUIMPER;ROND POINT GUTENBERG;Luminaire;E2805_1;;485.0;;21/01/2026;CITEOS QUIMPER;2026-01-21;;;;;non;non;non;non;non;non;non;non;non;non;non;aucune opération détectée
44909723;Validé;;Eclairage public;Tournée de nuit luminaire;QUIMPER;HENT KAMM;Luminaire;E232_1;;485.0;;21/01/2026;CITEOS QUIMPER;2026-01-21;;;;;non;non;non;non;non;non;non;non;non;non;non;aucune opération détectée
44909721;Validé;;Eclairage public;Tournée de nuit luminaire;QUIMPER;RUE SAINT ALOR;Luminaire;E231_1;;485.0;;21/01/2026;CITEOS QUIMPER;2026-01-21;;;;;non;non;non;non;non;non;non;non;non;non;non;aucune opération détectée
44909719;Validé;;Eclairage public;Tournée de nuit luminaire;QUIMPER;RUE SAINT ALOR;Luminaire;E230_1;;485.0;;21/01/2026;CITEOS QUIMPER;2026-01-21;;;;;non;non;non;non;non;non;non;non;non;non;non;aucune opération détectée
44909717;Validé;;Eclairage public;Tournée de nuit luminaire;QUIMPER;RUE SAINT ALOR;Luminaire;E229_1;;485.0;;21/01/2026;CITEOS QUIMPER;2026-01-21;;;;;non;non;non;non;non;non;non;non;non;non;non;aucune opération détectée
44909715;Validé;;Eclairage public;Tournée de nuit luminaire;QUIMPER;RUE AUGUSTE PERRET;Luminaire;E252_1;;485.0;;21/01/2026;CITEOS QUIMPER;2026-01-21;;;;;non;non;non;non;non;non;non;non;non;non;non;aucune opération détectée
44909713;Validé;;Eclairage public;Tournée de nuit luminaire;QUIMPER;RUE AUGUSTE PERRET;Luminaire;E256_1;;485.0;;21/01/2026;CITEOS QUIMPER;2026-01-21;;;;;non;non;non;non;non;non;non;non;non;non;non;aucune opération détectée
44909711;Validé;;Eclairage public;Tournée de nuit luminaire;QUIMPER;RUE AUGUSTE PERRET;Luminaire;E249_1;;485.0;;21/01/2026;CITEOS QUIMPER;2026-01-21;;;;;non;non;non;non;non;non;non;non;non;non;non;aucune opération détectée
44909709;Validé;;Eclairage public;Tournée de nuit luminaire;QUIMPER;RUE AUGUSTE PERRET;Luminaire;E258_1;;485.0;;21/01/2026;CITEOS QUIMPER;2026-01-21;;;;;non;non;non;non;non;non;non;non;non;non;non;aucune opération détectée
44909707;Validé;;Eclairage public;Tournée de nuit luminaire;QUIMPER;RUE DE KERAMBELLEC;Luminaire;E237_1;;485.0;;21/01/2026;CITEOS QUIMPER;2026-01-21;;;;;non;non;non;non;non;non;non;non;non;non;non;aucune opération détectée
44909705;Validé;;Eclairage public;Tournée de nuit luminaire;QUIMPER;RUE JULES HARDOUIN MANSART;Luminaire;E242_1;;485.0;;21/01/2026;CITEOS QUIMPER;2026-01-21;;;;;non;non;non;non;non;non;non;non;non;non;non;aucune opération détectée
44909703;Validé;;Eclairage public;Tournée de nuit luminaire;QUIMPER;RUE JULES HARDOUIN MANSART;Luminaire;E241_1;;485.0;;21/01/2026;CITEOS QUIMPER;2026-01-21;;;;;non;non;non;non;non;non;non;non;non;non;non;aucune opération détectée
44909701;Validé;;Eclairage public;Tournée de nuit luminaire;QUIMPER;RUE GEORGES BERNANOS;Luminaire;E327_1;;485.0;;21/01/2026;CITEOS QUIMPER;2026-01-21;;;;;non;non;non;non;non;non;non;non;non;non;non;aucune opération détectée
44909699;Validé;;Eclairage public;Tournée de nuit luminaire;QUIMPER;RUE LE CORBUSIER;Luminaire;E265_1;;485.0;;21/01/2026;CITEOS QUIMPER;2026-01-21;;;;;non;non;non;non;non;non;non;non;non;non;non;aucune opération détectée
44909697;Validé;;Eclairage public;Tournée de nuit luminaire;QUIMPER;RUE DE KEROMNES;Luminaire;E379_1;;485.0;;21/01/2026;CITEOS QUIMPER;2026-01-21;;;;;non;non;non;non;non;non;non;non;non;non;non;aucune opération détectée
44909695;Validé;;Eclairage public;Tournée de nuit luminaire;QUIMPER;RUE SAINT ALOR;Luminaire;E376_1;;485.0;;21/01/2026;CITEOS QUIMPER;2026-01-21;;;;;non;non;non;non;non;non;non;non;non;non;non;aucune opération détectée
44909693;A valider;;Eclairage public;Curatif Armoire;QUIMPER;RUE LEO LAGRANGE;Armoire;120;;;;21/01/2026;CITEOS QUIMPER;2026-01-21;CITEOS_EQUIPE 2;;;;non;non;non;non;non;non;non;non;non;non;non;aucune opération détectée
44909691;A valider;;Eclairage public;Curatif Armoire;QUIMPER;RUE SAINT ALOR;Armoire;167;;;;21/01/2026;CITEOS QUIMPER;2026-01-21;CITEOS_EQUIPE 2;;;;non;non;non;non;non;non;non;non;non;non;non;aucune opération détectée
44909689;Validé;;Eclairage public;Tournée de nuit luminaire;QUIMPER;AVENUE LEON BLUM;Luminaire;E3363;;485.0;;20/01/2026;CITEOS QUIMPER;2026-01-20;;;;;non;non;non;non;non;non;non;non;non;non;non;aucune opération détectée
44909687;Validé;;Eclairage public;Tournée de nuit luminaire;QUIMPER;AVENUE DU BRADEN;Luminaire;E1441_1;;485.0;;20/01/2026;CITEOS QUIMPER;2026-01-20;;;;;non;non;non;non;non;non;non;non;non;non;non;aucune opération détectée
44909685;Validé;;Eclairage public;Tournée de nuit luminaire;QUIMPER;BOULEVARD DE CREAC'H GWEN;Luminaire;E2261_1;;485.0;;20/01/2026;CITEOS QUIMPER;2026-01-20;;;;;non;non;non;non;non;non;non;non;non;non;non;aucune opération détectée
44909683;Validé;;Eclairage public;Tournée de nuit luminaire;QUIMPER;RUE FELIX LE DANTEC;Luminaire;E2969_1;;485.0;;20/01/2026;CITEOS QUIMPER;2026-01-20;;;;;non;non;non;non;non;non;non;non;non;non;non;aucune opération détectée
44909681;Validé;;Eclairage public;Tournée de nuit luminaire;QUIMPER;ALLEE DE KERNENEZ;Luminaire;E2282_1;;485.0;;20/01/2026;CITEOS QUIMPER;2026-01-20;;;;;non;non;non;non;non;non;non;non;non;non;non;aucune opération détectée
44909679;Validé;;Eclairage public;Tournée de nuit luminaire;QUIMPER;ALLEE DE KERNENEZ;Luminaire;E2281_1;;485.0;;20/01/2026;CITEOS QUIMPER;2026-01-20;;;;;non;non;non;non;non;non;non;non;non;non;non;aucune opération détectée
44909677;Validé;;Eclairage public;Tournée de nuit luminaire;QUIMPER;RUE PRESIDENT SADATE;Luminaire;E2289_1;;485.0;;20/01/2026;CITEOS QUIMPER;2026-01-20;;;;;non;non;non;non;non;non;non;non;non;non;non;aucune opération détectée
44909675;Validé;;Eclairage public;Tournée de nuit luminaire;QUIMPER;AVENUE DE LA PLAGE DES GUEUX;Luminaire;E3140_1;;485.0;;20/01/2026;CITEOS QUIMPER;2026-01-20;;;;;non;non;non;non;non;non;non;non;non;non;non;aucune opération détectée
44909673;Validé;;Eclairage public;Tournée de nuit luminaire;QUIMPER;AVENUE DE LA PLAGE DES GUEUX;Luminaire;E1667_1;;485.0;;20/01/2026;CITEOS QUIMPER;2026-01-20;;;;;non;non;non;non;non;non;non;non;non;non;non;aucune opération détectée
44909671;Validé;;Eclairage public;Tournée de nuit luminaire;QUIMPER;AVENUE DE KERADENNEC;Luminaire;E1537_1;;485.0;;20/01/2026;CITEOS QUIMPER;2026-01-20;;;;;non;non;non;non;non;non;non;non;non;non;non;aucune opération détectée
44909669;Validé;;Eclairage public;Tournée de nuit luminaire;QUIMPER;ROUTE DE BENODET;Luminaire;E1600_1;;485.0;;20/01/2026;CITEOS QUIMPER;2026-01-20;;;;;non;non;non;non;non;non;non;non;non;non;non;aucune opération détectée
44909667;Validé;;Eclairage public;Tournée de nuit luminaire;QUIMPER;ROUTE DE BENODET;Luminaire;E3128_1;;485.0;;20/01/2026;CITEOS QUIMPER;2026-01-20;;;;;non;non;non;non;non;non;non;non;non;non;non;aucune opération détectée
44909665;Validé;;Eclairage public;Tournée de nuit luminaire;QUIMPER;ROUTE DE BENODET;Luminaire;E1623_1;;485.0;;20/01/2026;CITEOS QUIMPER;2026-01-20;;;;;non;non;non;non;non;non;non;non;non;non;non;aucune opération détectée
44909663;Validé;;Eclairage public;Tournée de nuit luminaire;QUIMPER;AVENUE DE TI DOUAR;Luminaire;E676_1;;485.0;;20/01/2026;CITEOS QUIMPER;2026-01-20;;;;;non;non;non;non;non;non;non;non;non;non;non;aucune opération détectée
44909661;Validé;;Eclairage public;Tournée de nuit luminaire;QUIMPER;AVENUE DE TI DOUAR;Luminaire;E672_1;;485.0;;20/01/2026;CITEOS QUIMPER;2026-01-20;;;;;non;non;non;non;non;non;non;non;non;non;non;aucune opération détectée
44909659;Validé;;Eclairage public;Tournée de nuit luminaire;QUIMPER;AVENUE DE TY BOS;Luminaire;E667_1;;485.0;;20/01/2026;CITEOS QUIMPER;2026-01-20;;;;;non;non;non;non;non;non;non;non;non;non;non;aucune opération détectée
44909657;Validé;;Eclairage public;Tournée de nuit luminaire;QUIMPER;AVENUE GEORGES POMPIDOU;Luminaire;E1771_1;;485.0;;20/01/2026;CITEOS QUIMPER;2026-01-20;;;;;non;non;non;non;non;non;non;non;non;non;non;aucune opération détectée
44909655;Validé;;Eclairage public;Tournée de nuit luminaire;QUIMPER;AVENUE DE TY BOS;Luminaire;E660_1;;485.0;;20/01/2026;CITEOS QUIMPER;2026-01-20;;;;;non;non;non;non;non;non;non;non;non;non;non;aucune opération détectée
44909653;Validé;;Eclairage public;Tournée de nuit luminaire;QUIMPER;ALLEE VINCENT AURIOL;Luminaire;E3126_1;;485.0;;19/01/2026;CITEOS QUIMPER;2026-01-19;;;;;non;non;non;non;non;non;non;non;non;non;non;aucune opération détectée
44909651;Validé;;Eclairage public;Tournée de nuit luminaire;QUIMPER;RUE HENRI QUEFFELEC;Luminaire;E3235_1;;485.0;;19/01/2026;CITEOS QUIMPER;2026-01-19;;;;;non;non;non;non;non;non;non;non;non;non;non;aucune opération détectée
44909649;Validé;;Eclairage public;Tournée de nuit luminaire;QUIMPER;RUE MARCEL PAUL;Luminaire;E2826_1;;485.0;;19/01/2026;CITEOS QUIMPER;2026-01-19;;;;;non;non;non;non;non;non;non;non;non;non;non;aucune opération détectée
44909647;Validé;;Eclairage public;Tournée de nuit luminaire;QUIMPER;ALLEE GEORGES LACOMBE;Luminaire;E3523;;485.0;;19/01/2026;CITEOS QUIMPER;2026-01-19;;;;;non;non;non;non;non;non;non;non;non;non;non;aucune opération détectée
44909645;Validé;;Eclairage public;Tournée de nuit luminaire;QUIMPER;ALLEE GEORGES LACOMBE;Luminaire;E3518;;485.0;;19/01/2026;CITEOS QUIMPER;2026-01-19;;;;;non;non;non;non;non;non;non;non;non;non;non;aucune opération détectée
44909643;Validé;;Eclairage public;Tournée de nuit luminaire;QUIMPER;ALLEE ABBE GREGOIRE;Luminaire;E2841_1;;485.0;;19/01/2026;CITEOS QUIMPER;2026-01-19;;;;;non;non;non;non;non;non;non;non;non;non;non;aucune opération détectée
44909641;Validé;;Eclairage public;Tournée de nuit luminaire;QUIMPER;ALLEE ABBE GREGOIRE;Luminaire;E7_1;;485.0;;19/01/2026;CITEOS QUIMPER;2026-01-19;;;;;non;non;non;non;non;non;non;non;non;non;non;aucune opération détectée
44909639;Validé;;Eclairage public;Tournée de nuit luminaire;QUIMPER;ROUTE DE ROSPORDEN;Luminaire;E4_1;;485.0;;19/01/2026;CITEOS QUIMPER;2026-01-19;;;;;non;non;non;non;non;non;non;non;non;non;non;aucune opération détectée
44909637;Validé;;Eclairage public;Tournée de nuit luminaire;QUIMPER;ROUTE DE ROSPORDEN;Luminaire;E1_1;;485.0;;19/01/2026;CITEOS QUIMPER;2026-01-19;;;;;non;non;non;non;non;non;non;non;non;non;non;aucune opération détectée
44909635;Validé;;Eclairage public;Tournée de nuit luminaire;QUIMPER;ROUTE DE ROSPORDEN;Luminaire;E59_1;;485.0;;19/01/2026;CITEOS QUIMPER;2026-01-19;;;;;non;non;non;non;non;non;non;non;non;non;non;aucune opération détectée
44909633;Validé;;Eclairage public;Tournée de nuit luminaire;QUIMPER;RUE ALBERT STEPHAN;Luminaire;E71_1;;485.0;;19/01/2026;CITEOS QUIMPER;2026-01-19;;;;;non;non;non;non;non;non;non;non;non;non;non;aucune opération détectée
44909631;Validé;;Eclairage public;Tournée de nuit luminaire;QUIMPER;ROUTE DE ROSPORDEN;Luminaire;E2735_1;;485.0;;19/01/2026;CITEOS QUIMPER;2026-01-19;;;;;non;non;non;non;non;non;non;non;non;non;non;aucune opération détectée
44909629;Validé;;Eclairage public;Tournée de nuit luminaire;QUIMPER;ROUTE DE ROSPORDEN;Luminaire;E2739_1;;485.0;;19/01/2026;CITEOS QUIMPER;2026-01-19;;;;;non;non;non;non;non;non;non;non;non;non;non;aucune opération détectée
44909627;Validé;;Eclairage public;Tournée de nuit luminaire;QUIMPER;ROUTE DE ROSPORDEN;Luminaire;E2738_1;;485.0;;19/01/2026;CITEOS QUIMPER;2026-01-19;;;;;non;non;non;non;non;non;non;non;non;non;non;aucune opération détectée
44909625;Validé;;Eclairage public;Tournée de nuit luminaire;QUIMPER;ROUTE DE ROSPORDEN;Luminaire;E2737_1;;485.0;;19/01/2026;CITEOS QUIMPER;2026-01-19;;;;;non;non;non;non;non;non;non;non;non;non;non;aucune opération détectée
44909623;Validé;;Eclairage public;Tournée de nuit luminaire;QUIMPER;ROUTE DE ROSPORDEN;Luminaire;E2734_1;;485.0;;19/01/2026;CITEOS QUIMPER;2026-01-19;;;;;non;non;non;non;non;non;non;non;non;non;non;aucune opération détectée
44909621;Validé;;Eclairage public;Tournée de nuit luminaire;QUIMPER;ROUTE DE ROSPORDEN;Luminaire;E2733_1;;485.0;;19/01/2026;CITEOS QUIMPER;2026-01-19;;;;;non;non;non;non;non;non;non;non;non;non;non;aucune opération détectée
44909619;A valider;;Eclairage public;Curatif Point Lumineux;QUIMPER;RUE DE LA PAIX;Luminaire;E2190_1;12799.0;;;19/01/2026;CITEOS QUIMPER;2026-01-19;CITEOS_EQUIPE 2;Remplacement driver fonctionnement ok;1:15;remplacement driver fonctionnement ok;non;non;oui;non;oui;non;non;non;non;non;non;remplacement driver, remplacement driver et connexions
44909617;A valider;;Eclairage public;Curatif Point Lumineux;QUIMPER;IMPASSE MOLIERE;Luminaire;E2121_1;12805.0;;;19/01/2026;CITEOS QUIMPER;2026-01-19;CITEOS_EQUIPE 2;Remplacement fusible 2A;0:30;remplacement fusible 2a;oui;non;non;non;non;non;non;non;non;non;non;remplacement fusible
44909615;A valider;;Eclairage public;Curatif Point Lumineux;QUIMPER;RUE DE LUDUDU;Luminaire;P897_1;12793.0;;;19/01/2026;CITEOS QUIMPER;2026-01-19;CITEOS_EQUIPE 2;Remplacement porte fusible et remise en place du classe 2;1:00;remplacement porte fusible et remise en place du classe 2;oui;non;non;non;non;non;non;non;non;non;non;remplacement fusible
44909613;A valider;;Eclairage public;Curatif Point Lumineux;QUIMPER;RUE DU COSQUER;Luminaire;P2378_1;12811.0;;;19/01/2026;CITEOS QUIMPER;2026-01-19;CITEOS_EQUIPE 2;Remplacement driver 110W;1:00;remplacement driver 110w;non;non;oui;non;oui;non;non;non;non;non;non;remplacement driver, remplacement driver et connexions
44909611;Validé;;Eclairage public;Curatif Armoire;QUIMPER;RUE DU LAVOIR;Armoire;438;12807.0;;;19/01/2026;CITEOS QUIMPER;2026-01-19;CITEOS_EQUIPE 2;Réenclenchement disjoncteur général essais de fonctionnement;0:45;réenclenchement disjoncteur général essais de fonctionnement;non;non;non;non;non;non;non;non;oui;non;non;reenclenchement disjoncteur
44909609;A valider;;Eclairage public;Curatif Armoire;QUIMPER;RUE LEO LAGRANGE;Armoire;120;12809.0;;;19/01/2026;CITEOS QUIMPER;2026-01-19;CITEOS_EQUIPE 2;Remplacement fusible 25A départ 2 et remise en place d?un boîtier classe 2;1:00;remplacement fusible 25a départ 2 et remise en place d?un boîtier classe 2;oui;non;non;non;non;non;non;non;non;non;non;remplacement fusible
44909607;A valider;;Eclairage public;Curatif Point Lumineux;QUIMPER;;Luminaire;X:169618.91113793 Y: 6788204.9968088;;;;16/01/2026;CITEOS QUIMPER;2026-01-16;CITEOS_EQUIPE 1;Boite de dérivation changée;1:30;boite de dérivation changée;non;non;non;oui;non;non;non;non;non;non;non;remplacement boite derivation
44909605;Validé;;Eclairage public;Curatif Armoire;QUIMPER;RUE MARECHAL FOCH;Armoire;94;12795.0;;;14/01/2026;CITEOS QUIMPER;2026-01-13;CITEOS_EQUIPE 2;Séparation de la phase ep et de la phase 3 enedis. Remplacement du fusible du départ ep .;;séparation de la phase ep et de la phase 3 enedis. remplacement du fusible du départ ep .;oui;non;non;non;non;non;oui;non;non;non;non;remplacement fusible, separation phases cablage
44909603;Validé;;Eclairage public;Curatif Armoire;QUIMPER;RUE MICHELET;Armoire;112;12791.0;;;13/01/2026;CITEOS QUIMPER;2026-01-13;CITEOS_EQUIPE 2;;;;non;non;non;non;non;non;non;non;non;non;non;aucune opération détectée
44909601;A valider;;Eclairage public;Curatif Point Lumineux;QUIMPER;RUE PARMENTIER;Luminaire;E1885_1;12775.0;;;08/01/2026;CITEOS QUIMPER;2026-01-08;CITEOS_EQUIPE 2;Remplacement driver et réfection des connexions sur câble d?alimentation;2:00;remplacement driver et réfection des connexions sur câble d?alimentation;non;non;oui;non;oui;non;oui;non;non;non;non;remplacement driver, remplacement driver et connexions, separation phases cablage
44909599;A valider;;Eclairage public;Curatif Point Lumineux;QUIMPER;RUE DE L'ILE D'HOUAT;Luminaire;E1206;12781.0;;;06/01/2026;CITEOS QUIMPER;2026-01-06;CITEOS_EQUIPE 2;Reprise raccordement câble alimentation au niveau deE1207-1 et remplacement ampoule 70W;1:30;reprise raccordement câble alimentation au niveau dee1207-1 et remplacement ampoule 70w;non;oui;non;non;non;non;oui;non;non;oui;non;remplacement ampoule, separation phases cablage, reprise raccordement
44909597;A valider;;Eclairage public;Curatif Point Lumineux;QUIMPER;RUE WALLIS ET FUTUNA;Luminaire;E1414_1;12789.0;;;06/01/2026;CITEOS QUIMPER;2026-01-06;CITEOS_EQUIPE 2;Remplacement porte fusible et ampoule 70W;1:00;remplacement porte fusible et ampoule 70w;oui;oui;non;non;non;non;non;non;non;non;non;remplacement fusible, remplacement ampoule
44909595;A valider;;Eclairage public;Curatif Point Lumineux;QUIMPER;BOULEVARD DUPLEIX;Luminaire;C1359;12715.0;;;06/01/2026;CITEOS QUIMPER;2026-01-06;CITEOS_EQUIPE 2;Remplacement ampoule;0:45;remplacement ampoule;non;oui;non;non;non;non;non;non;non;non;non;remplacement ampoule
44909593;A valider;;Eclairage public;Curatif Point Lumineux;QUIMPER;;Luminaire;X:170397.38709634 Y: 6789282.1449138;;;;05/01/2026;CITEOS QUIMPER;2026-01-05;CITEOS_EQUIPE 2;;;;non;non;non;non;non;non;non;non;non;non;non;aucune opération détectée
44909591;A valider;;Eclairage public;Curatif Armoire;QUIMPER;;Armoire;X:170375.28558711 Y: 6789220.2055711;;;;05/01/2026;CITEOS QUIMPER;2026-01-05;CITEOS_EQUIPE 2;;;;non;non;non;non;non;non;non;non;non;non;non;aucune opération détectée
44909589;A valider;;Eclairage public;Curatif Point Lumineux;QUIMPER;RUE MICHELET;Luminaire;E2503_1;12787.0;;;05/01/2026;CITEOS QUIMPER;2026-01-05;CITEOS_EQUIPE 2;;;;non;non;non;non;non;non;non;non;non;non;non;aucune opération détectée
44909587;A valider;;Eclairage public;Curatif Point Lumineux;QUIMPER;RUE LOST AL LANN;Luminaire;E470_1;12785.0;;;05/01/2026;CITEOS QUIMPER;2026-01-05;CITEOS_EQUIPE 2;Plateau Led hs, Prévoir remplacement du luminaire;;plateau led hs, prévoir remplacement du luminaire;non;non;non;non;non;non;non;oui;non;non;non;plateau led hs
44909585;A valider;;Eclairage public;Curatif Point Lumineux;QUIMPER;AVENUE DES GIRONDINS;Luminaire;P998_1;12747.0;;;02/01/2026;CITEOS QUIMPER;2026-01-02;CITEOS_EQUIPE 1;Pose lanterne provisoire;1:30;pose lanterne provisoire;non;non;non;non;non;oui;non;non;non;non;non;pose lanterne provisoire
44909583;A valider;;Eclairage public;Curatif Point Lumineux;QUIMPER;ALLEE JEAN BAPTISTE LOUVET;Luminaire;P1070_1;12741.0;;;02/01/2026;CITEOS QUIMPER;2026-01-02;CITEOS_EQUIPE 1;Pose lanterne provisoire;1:00;pose lanterne provisoire;non;non;non;non;non;oui;non;non;non;non;non;pose lanterne provisoire
44909581;A valider;;Eclairage public;Curatif Point Lumineux;QUIMPER;RUE DU FRUGY;Luminaire;E2100_1;12761.0;;;02/01/2026;CITEOS QUIMPER;2026-01-02;CITEOS_EQUIPE 1;;1:00;;non;non;non;non;non;non;non;non;non;non;non;aucune opération détectée
44909579;Validé;;Eclairage public;Curatif Point Lumineux;QUIMPER;RUE DES RESEDAS;Luminaire;E1949_1;12753.0;;;02/01/2026;CITEOS QUIMPER;2026-01-02;CITEOS_EQUIPE 1;Dépose et pose;1:30;dépose et pose;non;non;non;non;non;oui;non;non;non;non;non;pose lanterne provisoire
44909577;A valider;;Eclairage public;Curatif Point Lumineux;QUIMPER;AVENUE DE TI PONT;Luminaire;K2015;12757.0;;;31/12/2025;CITEOS QUIMPER;2025-12-31;CITEOS_EQUIPE 1;;1:30;;non;non;non;non;non;non;non;non;non;non;non;aucune opération détectée
44909575;A valider;;Eclairage public;Curatif Point Lumineux;QUIMPER;RUE DE LA TOUR D'AUVERGNE;Luminaire;E1780_1;12769.0;;;31/12/2025;CITEOS QUIMPER;2025-12-31;CITEOS_EQUIPE 1;;1:00;;non;non;non;non;non;non;non;non;non;non;non;aucune opération détectée
44909573;A valider;;Eclairage public;Curatif Armoire;QUIMPER;RUE DE L'ILE D'HOUAT;Armoire;156;12767.0;;;31/12/2025;CITEOS QUIMPER;2025-12-31;CITEOS_EQUIPE 2;Travaux en cours - réalimentation par de l aérien.;;travaux en cours - réalimentation par de l aérien.;non;non;non;non;non;non;non;non;non;non;non;aucune opération détectée
44909571;A valider;;Eclairage public;Curatif Point Lumineux;QUIMPER;RUE AUGUSTE PERRET;Luminaire;E255_1;12765.0;;;31/12/2025;CITEOS QUIMPER;2025-12-31;CITEOS_EQUIPE 1;;0:45;;non;non;non;non;non;non;non;non;non;non;non;aucune opération détectée
44909569;A valider;;Eclairage public;Curatif Point Lumineux;QUIMPER;AVENUE DE TI PONT;Luminaire;K2096;;;;31/12/2025;CITEOS QUIMPER;2025-12-31;CITEOS_EQUIPE 2;remplacement de la lampe;;remplacement de la lampe;non;oui;non;non;non;non;non;non;non;non;non;remplacement ampoule
44909567;Validé;;Eclairage public;Curatif Armoire;QUIMPER;RUE LE DEAN;Armoire;66;12771.0;;;30/12/2025;CITEOS QUIMPER;2025-12-30;CITEOS_EQUIPE 1;Raz radiolite;1:00;raz radiolite;non;non;non;non;non;non;non;non;non;non;non;aucune opération détectée
44909565;A valider;;Eclairage public;Curatif Point Lumineux;QUIMPER;ROND POINT DE LUDUGRIS;Luminaire;P936_5;12773.0;;;30/12/2025;CITEOS QUIMPER;2025-12-30;CITEOS_EQUIPE 1;1/8 en panne;0:20;1/8 en panne;non;non;non;non;non;non;non;non;non;non;non;aucune opération détectée
44909563;Refusé;Travaux demandés lors de la demande d'intervention non effectués;Eclairage public;Curatif Point Lumineux;QUIMPER;CHEMIN DE L'EGLANTINE;Luminaire;K948_1;12749.0;;;24/12/2025;CITEOS QUIMPER;2025-12-24;CITEOS_EQUIPE 2;Plus alimenté depuis la tempête ciaran. Torsadé à tirer depuis l?ouvrage précédent;0:30;plus alimenté depuis la tempête ciaran. torsadé à tirer depuis l?ouvrage précédent;non;non;non;non;non;non;non;non;non;non;non;aucune opération détectée
44909561;A valider;;Eclairage public;Curatif Point Lumineux;QUIMPER;RUE LOUISE DE BETTIGNIES;Luminaire;K807_1;12737.0;;;24/12/2025;CITEOS QUIMPER;2025-12-24;CITEOS_EQUIPE 2;Remplacement ampoule 150W réfection des connexions câble alimentation;1:00;remplacement ampoule 150w réfection des connexions câble alimentation;non;oui;non;non;non;non;oui;non;non;non;non;remplacement ampoule, separation phases cablage
44909559;A valider;;Eclairage public;Curatif Point Lumineux;QUIMPER;AVENUE DE TI PONT;Luminaire;K2098;12739.0;;;24/12/2025;CITEOS QUIMPER;2025-12-24;CITEOS_EQUIPE 2;Remplacement ampoule 70W;0:30;remplacement ampoule 70w;non;oui;non;non;non;non;non;non;non;non;non;remplacement ampoule
44909557;A valider;;Eclairage public;Curatif Point Lumineux;QUIMPER;;Luminaire;X:170637.06776673 Y: 6792313.6149371;;;;24/12/2025;CITEOS QUIMPER;2025-12-24;CITEOS_EQUIPE 2;Changement Ampoule 70 watt;;changement ampoule 70 watt;non;oui;non;non;non;non;non;non;non;non;non;remplacement ampoule
44909555;A valider;;Eclairage public;Curatif Point Lumineux;QUIMPER;RUE DES RESEDAS;Luminaire;E1951_1;12711.0;;;24/12/2025;CITEOS QUIMPER;2025-12-24;CITEOS_EQUIPE 2;Réfection connexions driver;1:00;réfection connexions driver;non;non;oui;non;oui;non;non;non;non;non;non;remplacement driver, remplacement driver et connexions
44909553;A valider;;Eclairage public;Curatif Point Lumineux;QUIMPER;RUE DU PARC;Luminaire;C364_1;12743.0;;;24/12/2025;CITEOS QUIMPER;2025-12-24;CITEOS_EQUIPE 2;Remplacement fusible 4A;0:30;remplacement fusible 4a;oui;non;non;non;non;non;non;non;non;non;non;remplacement fusible
44909551;Validé;;Eclairage public;Curatif Point Lumineux;QUIMPER;RUE DE L'ILE BENIGUET;Luminaire;E1312_1;12763.0;;;23/12/2025;CITEOS QUIMPER;2025-12-23;CITEOS_EQUIPE 2;Resserage des connections du point E 1311 .;;resserage des connections du point e 1311 .;non;non;non;non;non;non;non;non;non;non;non;aucune opération détectée
44909549;Validé;;Eclairage public;Curatif Armoire;QUIMPER;RUE DE L'ILE D'HOUAT;Armoire;156;12759.0;;;22/12/2025;CITEOS QUIMPER;2025-12-22;CITEOS_EQUIPE 2;Remplacement fusible;;remplacement fusible;oui;non;non;non;non;non;non;non;non;non;non;remplacement fusible
44909547;Validé;;Eclairage public;Curatif Armoire;QUIMPER;AVENUE JACQUES LE VIOL;Armoire;132;12755.0;;;22/12/2025;CITEOS QUIMPER;2025-12-22;CITEOS_EQUIPE 2;Remise en service;;remise en service;non;non;non;non;non;non;non;non;non;non;non;aucune opération détectée
44909545;Validé;;Eclairage public;Curatif Armoire;QUIMPER;RUE DE L'ILE D'HOUAT;Armoire;156;12751.0;;;19/12/2025;CITEOS QUIMPER;2025-12-19;CITEOS_EQUIPE 1;Réarmement sectionneur général.  Cadenas cassé.  Changé;0:30;réarmement sectionneur général.  cadenas cassé.  changé;non;non;non;non;non;non;non;non;oui;non;non;reenclenchement disjoncteur
44909543;Validé;;Eclairage public;Curatif Point Lumineux;QUIMPER;RUE COLONEL BERTHAUD-BOURRIERES;Luminaire;P1141_1;12745.0;;;19/12/2025;CITEOS QUIMPER;2025-12-19;CITEOS_EQUIPE 1;Câble en défaut vers dernier PL (présence boîte ou rallongement). Sécurisé,  prévoir remplacement portée.;;câble en défaut vers dernier pl (présence boîte ou rallongement). sécurisé,  prévoir remplacement portée.;non;non;non;oui;non;non;non;non;non;non;non;remplacement boite derivation
44909541;A valider;;Eclairage public;Curatif Point Lumineux;QUIMPER;RUE DE ROZOLEN;Luminaire;E930_1;12733.0;;;18/12/2025;CITEOS QUIMPER;2025-12-18;CITEOS_EQUIPE 2;Remise en place du coffret cl 2 sur le pba;;remise en place du coffret cl 2 sur le pba;non;non;non;non;non;non;non;non;non;non;non;aucune opération détectée
44909539;A valider;;Eclairage public;Curatif Point Lumineux;QUIMPER;BOULEVARD DUPLEIX;Luminaire;C1358_2;12715.0;;;18/12/2025;CITEOS QUIMPER;2025-12-18;CITEOS_EQUIPE 2;;;;non;non;non;non;non;non;non;non;non;non;non;aucune opération détectée
44909537;A valider;;Eclairage public;Curatif Point Lumineux;QUIMPER;BOULEVARD DUPLEIX;Luminaire;C1358;12715.0;;;18/12/2025;CITEOS QUIMPER;2025-12-18;CITEOS_EQUIPE 2;;;;non;non;non;non;non;non;non;non;non;non;non;aucune opération détectée
44909535;A valider;;Eclairage public;Curatif Point Lumineux;QUIMPER;BOULEVARD DUPLEIX;Luminaire;C1357_2;12715.0;;;18/12/2025;CITEOS QUIMPER;2025-12-18;CITEOS_EQUIPE 2;;;;non;non;non;non;non;non;non;non;non;non;non;aucune opération détectée
44909533;A valider;;Eclairage public;Curatif Point Lumineux;QUIMPER;BOULEVARD DUPLEIX;Luminaire;C1357;12715.0;;;18/12/2025;CITEOS QUIMPER;2025-12-18;CITEOS_EQUIPE 2;;;;non;non;non;non;non;non;non;non;non;non;non;aucune opération détectée
44909531;A valider;;Eclairage public;Curatif Point Lumineux;QUIMPER;RUE TREDERN DE LEZEREC;Luminaire;E2753_1;12707.0;;;11/12/2025;CITEOS QUIMPER;2025-12-11;CITEOS_EQUIPE 1;Changement de driver 110w 0,2-0,7 A ampdim.Essais ok.;1:00;changement de driver 110w 0,2-0,7 a ampdim.essais ok.;non;non;oui;non;oui;non;non;non;non;non;non;remplacement driver, remplacement driver et connexions
44909529;A valider;;Eclairage public;Curatif Point Lumineux;QUIMPER;RUE ROGER SALENGRO;Luminaire;E1272_1;12735.0;;;11/12/2025;CITEOS QUIMPER;2025-12-11;CITEOS_EQUIPE 1;Changement de lampe 100w shp.Essais ok.;1:00;changement de lampe 100w shp.essais ok.;non;oui;non;non;non;non;non;non;non;non;non;remplacement ampoule
44909527;A valider;;Eclairage public;Curatif Point Lumineux;QUIMPER;RUE DE L'ILE D'HOUAT;Luminaire;E1143_1;12713.0;;;11/12/2025;CITEOS QUIMPER;2025-12-11;CITEOS_EQUIPE 1;E1142 et E1145 en panne. Prévoir intervention vl .;;e1142 et e1145 en panne. prévoir intervention vl .;non;non;non;non;non;non;non;non;non;non;non;aucune opération détectée
44909525;A valider;;Eclairage public;Curatif Point Lumineux;QUIMPER;PLACE DE LOCRONAN;Luminaire;C202_1;12687.0;;;11/12/2025;CITEOS QUIMPER;2025-12-11;CITEOS_EQUIPE 1;Changement de lampe 70w shp .Essais ok.;;changement de lampe 70w shp .essais ok.;non;oui;non;non;non;non;non;non;non;non;non;remplacement ampoule
44909523;A valider;;Eclairage public;Curatif Point Lumineux;QUIMPER;CITE DE KERGUELEN;Luminaire;C682_1;12719.0;;;11/12/2025;CITEOS QUIMPER;2025-12-11;CITEOS_EQUIPE 1;Point lumineux hors service suite aux travaux  quai de l 'Odette.;0:30;point lumineux hors service suite aux travaux  quai de l 'odette.;non;non;non;non;non;non;non;non;non;non;non;aucune opération détectée
44909521;A valider;;Eclairage public;Curatif Point Lumineux;QUIMPER;ESPLANADE FRANCOIS MITTERRAND;Luminaire;C165_2;12693.0;;;11/12/2025;CITEOS QUIMPER;2025-12-11;CITEOS_EQUIPE 1;Changement de lampe 70w cdm t ,d amorceur et de ballast. La lampe s'allume très légèrement. Prévoir remplacement du luminaire.;1:00;changement de lampe 70w cdm t ,d amorceur et de ballast. la lampe s'allume très légèrement. prévoir remplacement du luminaire.;non;oui;oui;non;non;non;non;non;non;non;non;remplacement ampoule, remplacement driver
44909519;A valider;;Eclairage public;Curatif Point Lumineux;QUIMPER;IMPASSE DE LA GARE;Luminaire;C1198_1;12697.0;;;11/12/2025;CITEOS QUIMPER;2025-12-11;CITEOS_EQUIPE 1;Impossibilité d'accès .Intervention à reprogrammer, prévoir location nacelle toucan  spécifique.;0:30;impossibilité d'accès .intervention à reprogrammer, prévoir location nacelle toucan  spécifique.;non;non;non;non;non;non;non;non;non;non;non;aucune opération détectée
44909517;A valider;;Eclairage public;Curatif Armoire;QUIMPER;ROUTE DE KEROGAN;Armoire;424;12729.0;;;11/12/2025;CITEOS QUIMPER;2025-12-11;CITEOS_EQUIPE 1;Reenclenchement DB 30A 500mA et disjoncteur tétra 32A .Essais ok;1:00;reenclenchement db 30a 500ma et disjoncteur tétra 32a .essais ok;non;non;non;non;non;non;non;non;oui;non;non;reenclenchement disjoncteur
44909515;A valider;;Eclairage public;Curatif Armoire;QUIMPER;ROUTE DE KEROGAN;Armoire;424;12729.0;;;11/12/2025;CITEOS QUIMPER;2025-12-11;CITEOS_EQUIPE 1;Reenclenchement DB dans poste ( 30A 500mA ) et Reenclenchement du sectionneur de tête  ( disjoncteur tétra 32A) Recalibrage du fusible départ. 32A Tout est pris sur 1 seul  départ.Prevoir peut être d'équilibrer sur 2 phases car la 3 ème est deraccordee.;1:00;reenclenchement db dans poste ( 30a 500ma ) et reenclenchement du sectionneur de tête  ( disjoncteur tétra 32a) recalibrage du fusible départ. 32a tout est pris sur 1 seul  départ.prevoir peut être d'équilibrer sur 2 phases car la 3 ème est deraccordee.;oui;non;non;non;non;non;non;non;oui;non;non;remplacement fusible, reenclenchement disjoncteur
44909513;A valider;;Eclairage public;Curatif Point Lumineux;QUIMPER;CITE DE KERGUELEN;Luminaire;C684_1;12727.0;;;11/12/2025;CITEOS QUIMPER;2025-12-11;CITEOS_EQUIPE 1;Points lumineux hors service temporairement suite aux travaux. Remis en service en cour.;0:15;points lumineux hors service temporairement suite aux travaux. remis en service en cour.;non;non;non;non;non;non;non;non;non;non;non;aucune opération détectée
44909511;A valider;;Eclairage public;Curatif Point Lumineux;QUIMPER;CITE DE KERGUELEN;Luminaire;C683_1;12727.0;;;11/12/2025;CITEOS QUIMPER;2025-12-11;CITEOS_EQUIPE 1;Points lumineux hors service temporairement suite aux travaux. Remis en service en cour.;0:15;points lumineux hors service temporairement suite aux travaux. remis en service en cour.;non;non;non;non;non;non;non;non;non;non;non;aucune opération détectée
44909509;A valider;;Eclairage public;Curatif Point Lumineux;QUIMPER;CITE DE KERGUELEN;Luminaire;C682_1;12727.0;;;11/12/2025;CITEOS QUIMPER;2025-12-11;CITEOS_EQUIPE 1;Points lumineux hors service temporairement suite aux travaux. Remis en service en cour.;0:15;points lumineux hors service temporairement suite aux travaux. remis en service en cour.;non;non;non;non;non;non;non;non;non;non;non;aucune opération détectée
44909507;A valider;;Eclairage public;Curatif Point Lumineux;QUIMPER;CITE DE KERGUELEN;Luminaire;C681_1;12727.0;;;11/12/2025;CITEOS QUIMPER;2025-12-11;CITEOS_EQUIPE 1;Points lumineux hors service temporairement suite aux travaux. Remis en service en cour.;0:15;points lumineux hors service temporairement suite aux travaux. remis en service en cour.;non;non;non;non;non;non;non;non;non;non;non;aucune opération détectée
44909505;A valider;;Eclairage public;Curatif Armoire;QUIMPER;RUE DU MOULIN VERT;Armoire;108;12731.0;;;10/12/2025;CITEOS QUIMPER;2025-12-10;CITEOS_EQUIPE 2;Remplacement fusible 20 A départ 2 essais de fonctionnement ok;0:45;remplacement fusible 20 a départ 2 essais de fonctionnement ok;oui;non;non;non;non;non;non;non;non;non;non;remplacement fusible
44909503;A valider;;Eclairage public;Curatif Point Lumineux;QUIMPER;BOULEVARD DE BRETAGNE;Luminaire;P492_1;12725.0;;;10/12/2025;CITEOS QUIMPER;2025-12-10;CITEOS_EQUIPE 2;Resserrage des câbles au niveau du porte fusible;0:30;resserrage des câbles au niveau du porte fusible;oui;non;non;non;non;non;non;non;non;non;non;remplacement fusible
44909501;A valider;;Eclairage public;Curatif Point Lumineux;QUIMPER;VENELLE DU MOULIN AU DUC;Luminaire;C300_1;12723.0;;;09/12/2025;CITEOS QUIMPER;2025-12-09;CITEOS_EQUIPE 2;Remplacement ampoule 70W;1:00;remplacement ampoule 70w;non;oui;non;non;non;non;non;non;non;non;non;remplacement ampoule
44909499;Validé;;Eclairage public;Curatif Point Lumineux;QUIMPER;RUE FELIX BILIEN;Luminaire;P1130_1;12721.0;;;09/12/2025;CITEOS QUIMPER;2025-12-09;CITEOS_EQUIPE 2;Réarmement variateur essais ok;0:30;réarmement variateur essais ok;non;non;non;non;non;non;non;non;oui;non;non;reenclenchement disjoncteur
44909497;Validé;;Eclairage public;Curatif Point Lumineux;QUIMPER;RUE DE ROZOLEN;Luminaire;E935_1;12717.0;;;09/12/2025;CITEOS QUIMPER;2025-12-09;CITEOS_EQUIPE 2;Remplacement fusible 25A départ 2;0:30;remplacement fusible 25a départ 2;oui;non;non;non;non;non;non;non;non;non;non;remplacement fusible
44909495;Validé;;Eclairage public;Curatif Armoire;QUIMPER;RUE BOURG LES BOURGS;Armoire;42;12709.0;;;04/12/2025;CITEOS QUIMPER;2025-12-04;CITEOS_EQUIPE 1;;0:30;;non;non;non;non;non;non;non;non;non;non;non;aucune opération détectée
44909493;A valider;;Eclairage public;Curatif Armoire;QUIMPER;RUE GEORGES PHILIPPAR;Armoire;6;12705.0;;;04/12/2025;CITEOS QUIMPER;2025-12-04;CITEOS_EQUIPE 2;Intervention le matin même sur l'armoire. Voir le CR 44909483. Un mât était tombé dans la tranchée du chantier.;0:01;intervention le matin même sur l'armoire. voir le cr 44909483. un mât était tombé dans la tranchée du chantier.;non;non;non;non;non;non;non;non;non;non;non;aucune opération détectée
44909491;A valider;;Eclairage public;Curatif Armoire;QUIMPER;;Armoire;X:172061.08411662 Y: 6789051.317017;;;;03/12/2025;CITEOS QUIMPER;2025-12-03;CITEOS_EQUIPE 1;;0:30;;non;non;non;non;non;non;non;non;non;non;non;aucune opération détectée
44909489;A valider;;Eclairage public;Curatif Point Lumineux;QUIMPER;RUE FANCH BEGOT;Luminaire;E35_1;12691.0;;;02/12/2025;CITEOS QUIMPER;2025-12-02;CITEOS_EQUIPE 2;Fixation du capot cassé, mise en place de celui-ci à  l'aide d'un colson, Prévoir remplacement du luminaire et élagage;;fixation du capot cassé, mise en place de celui-ci à  l'aide d'un colson, prévoir remplacement du luminaire et élagage;non;non;non;non;non;non;non;non;non;non;non;aucune opération détectée
44909487;A valider;;Eclairage public;Curatif Point Lumineux;QUIMPER;RUE CHANOINE ABGRALL;Luminaire;P1741_1;12695.0;;;02/12/2025;CITEOS QUIMPER;2025-12-02;CITEOS_EQUIPE 2;;;;non;non;non;non;non;non;non;non;non;non;non;aucune opération détectée
44909485;A valider;;Eclairage public;Curatif Armoire;QUIMPER;ROUTE DE KEROGAN;Armoire;424;12703.0;;;02/12/2025;CITEOS QUIMPER;2025-12-02;CITEOS_EQUIPE 2;Plus de tension à l'armoire, faire intervenir énédis pour remise sous tension, ensuite on pourra intervenir pour la recherche de défaut;;plus de tension à l'armoire, faire intervenir énédis pour remise sous tension, ensuite on pourra intervenir pour la recherche de défaut;non;non;non;non;non;non;non;non;non;non;non;aucune opération détectée
44909483;Validé;;Eclairage public;Curatif Point Lumineux;QUIMPER;PLACE D'ECOSSE;Luminaire;P832_1;12701.0;;;02/12/2025;CITEOS QUIMPER;2025-12-02;CITEOS_EQUIPE 2;Le mat P286-1 est tombé dans une tranchée. Le câble était déconnecté, conducteurs  en court-circuit le mat a été reposé en provisoire, reconnection du classe2, essai ok;;le mat p286-1 est tombé dans une tranchée. le câble était déconnecté, conducteurs  en court-circuit le mat a été reposé en provisoire, reconnection du classe2, essai ok;non;non;non;non;non;oui;non;non;non;non;non;pose lanterne provisoire
44909481;A valider;;Eclairage public;Curatif Armoire;QUIMPER;ROND POINT AR MEILHOU GLAS;Armoire;437;12699.0;;;01/12/2025;CITEOS QUIMPER;2025-12-01;CITEOS_EQUIPE 2;Armoire ouverte suite à des travaux, relance ok;1:00;armoire ouverte suite à des travaux, relance ok;non;non;non;non;non;non;non;non;non;non;non;aucune opération détectée
44909479;A valider;;Eclairage public;Curatif Point Lumineux;QUIMPER;CHEMIN DU HALAGE;Luminaire;P2275_1;12685.0;;;28/11/2025;CITEOS QUIMPER;2025-11-28;CITEOS_EQUIPE 2;;;;non;non;non;non;non;non;non;non;non;non;non;aucune opération détectée
44909477;A valider;;Eclairage public;Curatif Point Lumineux;QUIMPER;IMPASSE JEAN OBERLE;Luminaire;C565_1;12671.0;;;28/11/2025;CITEOS QUIMPER;2025-11-28;CITEOS_EQUIPE 2;;;;non;non;non;non;non;non;non;non;non;non;non;aucune opération détectée
44909475;A valider;;Eclairage public;Curatif Point Lumineux;QUIMPER;RUE LE DEAN;Luminaire;E3144_1;12677.0;;;28/11/2025;CITEOS QUIMPER;2025-11-28;CITEOS_EQUIPE 2;Remplacement du classe2 type1, essai ok;;remplacement du classe2 type1, essai ok;non;non;non;non;non;non;non;non;non;non;non;aucune opération détectée
44909473;A valider;;Eclairage public;Curatif Point Lumineux;QUIMPER;RUE LE DEAN;Luminaire;E3144_1;12677.0;;;28/11/2025;CITEOS QUIMPER;2025-11-28;CITEOS_EQUIPE 2;Remplacement du coffret classe2, essai ok;;remplacement du coffret classe2, essai ok;non;non;non;non;non;non;non;non;non;non;non;aucune opération détectée
44909471;A valider;;Eclairage public;Curatif Point Lumineux;QUIMPER;ALLEE DOUR RU;Luminaire;P1501_1;12689.0;;;28/11/2025;CITEOS QUIMPER;2025-11-28;CITEOS_EQUIPE 2;C'était l?ouvrage P 1500_1;;c'était l?ouvrage p 1500_1;non;non;non;non;non;non;non;non;non;non;non;aucune opération détectée
44909469;A valider;;Eclairage public;Curatif Armoire;QUIMPER;RUE POLIG MONJARRET;Armoire;491;12683.0;;;27/11/2025;CITEOS QUIMPER;2025-11-27;CITEOS_EQUIPE 1;Vandalisme et vol de câble hent kamm. 3166 puis sur les 4 mats suivant.. sécurisé;;vandalisme et vol de câble hent kamm. 3166 puis sur les 4 mats suivant.. sécurisé;non;non;non;non;non;non;non;non;non;non;non;aucune opération détectée
44909467;Validé;;Eclairage public;Curatif Point Lumineux;QUIMPER;ROUTE DE TY NAY;Luminaire;K1139_1;;480.0;;27/11/2025;CITEOS QUIMPER;2025-11-27;CITEOS_EQUIPE 2;Lanterne HS déposée.;;lanterne hs déposée.;non;non;non;non;non;oui;non;oui;non;non;non;pose lanterne provisoire, plateau led hs
44909465;A valider;;Eclairage public;Curatif Point Lumineux;QUIMPER;AVENUE DE BECHARLES;Luminaire;K2073_2;;480.0;;27/11/2025;CITEOS QUIMPER;2025-11-27;CITEOS_EQUIPE 2;;;;non;non;non;non;non;non;non;non;non;non;non;aucune opération détectée
44909463;A valider;;Eclairage public;Curatif Point Lumineux;QUIMPER;RUE DE LA REPUBLIQUE;Luminaire;K661_1;;480.0;;27/11/2025;CITEOS QUIMPER;2025-11-27;CITEOS_EQUIPE 2;Le pavé Led de la lanterne est HS . Lanterne déposée.;;le pavé led de la lanterne est hs . lanterne déposée.;non;non;non;non;non;oui;non;oui;non;non;non;pose lanterne provisoire, plateau led hs
44909461;A valider;;Eclairage public;Curatif Point Lumineux;QUIMPER;RUE KERHUEL;Luminaire;K1294_1;;480.0;;27/11/2025;CITEOS QUIMPER;2025-11-27;CITEOS_EQUIPE 1;Modifié.  Non livré;;modifié.  non livré;non;non;non;non;non;non;non;non;non;non;non;aucune opération détectée
44909459;A valider;;Eclairage public;Curatif Point Lumineux;QUIMPER;RUE KERHUEL;Luminaire;K1293_1;;480.0;;27/11/2025;CITEOS QUIMPER;2025-11-27;CITEOS_EQUIPE 1;Modifié.  Non livré;;modifié.  non livré;non;non;non;non;non;non;non;non;non;non;non;aucune opération détectée
44909457;A valider;;Eclairage public;Curatif Point Lumineux;QUIMPER;RUE KERHUEL;Luminaire;K1653_1;;480.0;;27/11/2025;CITEOS QUIMPER;2025-11-27;CITEOS_EQUIPE 1;Modifié.  Non livré;;modifié.  non livré;non;non;non;non;non;non;non;non;non;non;non;aucune opération détectée
44909455;A valider;;Eclairage public;Curatif Point Lumineux;QUIMPER;RUE KERHUEL;Luminaire;K1292_1;;480.0;;27/11/2025;CITEOS QUIMPER;2025-11-27;CITEOS_EQUIPE 1;Modifié.  Non livré;;modifié.  non livré;non;non;non;non;non;non;non;non;non;non;non;aucune opération détectée
44909453;A valider;;Eclairage public;Curatif Point Lumineux;QUIMPER;RUE DE STANG BIHAN;Luminaire;K2065;;480.0;;27/11/2025;CITEOS QUIMPER;2025-11-27;CITEOS_EQUIPE 1;;;;non;non;non;non;non;non;non;non;non;non;non;aucune opération détectée
44909451;A valider;;Eclairage public;Curatif Point Lumineux;QUIMPER;RUE DE LA REPUBLIQUE;Luminaire;K1826_1;;480.0;;27/11/2025;CITEOS QUIMPER;2025-11-27;CITEOS_EQUIPE 2;Reconnection du neutre dans la lanterne.;;reconnection du neutre dans la lanterne.;non;non;non;non;non;oui;non;non;non;non;non;pose lanterne provisoire
44909449;A valider;;Eclairage public;Curatif Point Lumineux;QUIMPER;PLACE DE LA CROIX DES GARDIENS;Luminaire;K308_1;;480.0;;27/11/2025;CITEOS QUIMPER;2025-11-27;CITEOS_EQUIPE 1;;;;non;non;non;non;non;non;non;non;non;non;non;aucune opération détectée
44909447;A valider;;Eclairage public;Curatif Point Lumineux;QUIMPER;ROUTE DE BREST;Luminaire;K927_1;;480.0;;27/11/2025;CITEOS QUIMPER;2025-11-27;CITEOS_EQUIPE 2;Après élagage pour atteindre la lanterne,  j?ai constaté qu'elle était HS .;;après élagage pour atteindre la lanterne,  j?ai constaté qu'elle était hs .;non;non;non;non;non;oui;non;oui;non;non;non;pose lanterne provisoire, plateau led hs
44909445;A valider;;Eclairage public;Curatif Point Lumineux;QUIMPER;PLACE DE LA CROIX DES GARDIENS;Luminaire;K2054;;480.0;;27/11/2025;CITEOS QUIMPER;2025-11-27;CITEOS_EQUIPE 1;;;;non;non;non;non;non;non;non;non;non;non;non;aucune opération détectée
44909443;A valider;;Eclairage public;Curatif Point Lumineux;QUIMPER;ROUTE DU LOC'H;Luminaire;K362_1;;480.0;;26/11/2025;CITEOS QUIMPER;2025-11-26;CITEOS_EQUIPE 1;;;;non;non;non;non;non;non;non;non;non;non;non;aucune opération détectée
44909441;A valider;;Eclairage public;Curatif Point Lumineux;QUIMPER;PLACE DE LA CROIX DES GARDIENS;Luminaire;K2052_2;;480.0;;26/11/2025;CITEOS QUIMPER;2025-11-26;CITEOS_EQUIPE 1;;;;non;non;non;non;non;non;non;non;non;non;non;aucune opération détectée
44909439;A valider;;Eclairage public;Curatif Point Lumineux;QUIMPER;RUE JEAN XXIII;Luminaire;E155_1;12679.0;;;26/11/2025;CITEOS QUIMPER;2025-11-26;CITEOS_EQUIPE 2;Absence de capot Luminaire à remplacer;0:15;absence de capot luminaire à remplacer;non;non;non;non;non;non;non;non;non;non;non;aucune opération détectée
44909437;A valider;;Eclairage public;Curatif Point Lumineux;QUIMPER;RUE GUILLAUME BOUGEANT;Luminaire;E2384_1;12681.0;;;26/11/2025;CITEOS QUIMPER;2025-11-26;CITEOS_EQUIPE 2;Ce jour l?ensemble des luminaires de la rue fonctionne;0:30;ce jour l?ensemble des luminaires de la rue fonctionne;non;non;non;non;non;non;non;non;non;non;non;aucune opération détectée
44909435;A valider;;Eclairage public;Curatif Point Lumineux;QUIMPER;ROUTE DE CUZON;Luminaire;K1149_1;;480.0;;26/11/2025;CITEOS QUIMPER;2025-11-26;CITEOS_EQUIPE 1;;;;non;non;non;non;non;non;non;non;non;non;non;aucune opération détectée
44909433;A valider;;Eclairage public;Curatif Point Lumineux;QUIMPER;HENT GLAZ;Luminaire;K1219_1;;480.0;;26/11/2025;CITEOS QUIMPER;2025-11-26;CITEOS_EQUIPE 1;Pavé Led Hs. Devis en cours;;pavé led hs. devis en cours;non;non;non;non;non;non;non;oui;non;non;non;plateau led hs
44909431;A valider;;Eclairage public;Curatif Point Lumineux;QUIMPER;RUE MONSEIGNEUR DU MARHALLAC'H;Luminaire;K1396_1;;480.0;;25/11/2025;CITEOS QUIMPER;2025-11-25;CITEOS_EQUIPE 1;;;;non;non;non;non;non;non;non;non;non;non;non;aucune opération détectée
44909429;A valider;;Eclairage public;Curatif Point Lumineux;QUIMPER;;Luminaire;X:171057.84514549 Y: 6791198.9975136;;;;25/11/2025;CITEOS QUIMPER;2025-11-25;CITEOS_EQUIPE 1;;;;non;non;non;non;non;non;non;non;non;non;non;aucune opération détectée
44909427;A valider;;Eclairage public;Curatif Point Lumineux;QUIMPER;;Luminaire;X:171045.85122398 Y: 6791286.5697398;;;;25/11/2025;CITEOS QUIMPER;2025-11-25;CITEOS_EQUIPE 1;Suite demande riverains sur place;;suite demande riverains sur place;non;non;non;non;non;non;non;non;non;non;non;aucune opération détectée
44909425;A valider;;Eclairage public;Curatif Point Lumineux;QUIMPER;RUE CHANOINE KERBRAT;Luminaire;K1406_1;;480.0;;25/11/2025;CITEOS QUIMPER;2025-11-25;CITEOS_EQUIPE 1;;;;non;non;non;non;non;non;non;non;non;non;non;aucune opération détectée
44909423;A valider;;Eclairage public;Curatif Point Lumineux;QUIMPER;ALLEE JEAN LE CORRE;Luminaire;K1419_1;;480.0;;25/11/2025;CITEOS QUIMPER;2025-11-25;CITEOS_EQUIPE 1;;;;non;non;non;non;non;non;non;non;non;non;non;aucune opération détectée
44909421;A valider;;Eclairage public;Curatif Point Lumineux;QUIMPER;RUE LEON JOUHAUX;Luminaire;K532_1;;480.0;;25/11/2025;CITEOS QUIMPER;2025-11-25;CITEOS_EQUIPE 1;Armoire dans cave, accès par vigik;;armoire dans cave, accès par vigik;non;non;non;non;non;non;non;non;non;non;non;aucune opération détectée
44909419;A valider;;Eclairage public;Curatif Point Lumineux;QUIMPER;RUE CHARLES CHASSE;Luminaire;K444_1;;480.0;;25/11/2025;CITEOS QUIMPER;2025-11-25;CITEOS_EQUIPE 1;;;;non;non;non;non;non;non;non;non;non;non;non;aucune opération détectée
44909417;A valider;;Eclairage public;Curatif Point Lumineux;QUIMPER;ALLEE DE LA NOUVELLE METAIRIE;Luminaire;K2110;;480.0;;24/11/2025;CITEOS QUIMPER;2025-11-24;CITEOS_EQUIPE 2;Remplacement fusible 2A;0:15;remplacement fusible 2a;oui;non;non;non;non;non;non;non;non;non;non;remplacement fusible
44909415;A valider;;Eclairage public;Curatif Point Lumineux;QUIMPER;ALLEE DE LA NOUVELLE METAIRIE;Luminaire;K2113;;480.0;;24/11/2025;CITEOS QUIMPER;2025-11-24;CITEOS_EQUIPE 2;Absence de luminaire;0:15;absence de luminaire;non;non;non;non;non;non;non;non;non;non;non;aucune opération détectée
44909413;A valider;;Eclairage public;Curatif Point Lumineux;QUIMPER;RUE D'ORENSE;Luminaire;K1947;;480.0;;24/11/2025;CITEOS QUIMPER;2025-11-24;CITEOS_EQUIPE 2;Essais fonctionnement ok;0:15;essais fonctionnement ok;non;non;non;non;non;non;non;non;non;non;non;aucune opération détectée
44909411;A valider;;Eclairage public;Curatif Point Lumineux;QUIMPER;RUE DE MISSILIEN;Luminaire;K645_1;;480.0;;24/11/2025;CITEOS QUIMPER;2025-11-24;CITEOS_EQUIPE 2;Remplacement ampoule;0:45;remplacement ampoule;non;oui;non;non;non;non;non;non;non;non;non;remplacement ampoule
44909409;A valider;;Eclairage public;Curatif Point Lumineux;QUIMPER;RUE JEANNE D'ARC;Luminaire;K808_1;;480.0;;24/11/2025;CITEOS QUIMPER;2025-11-24;CITEOS_EQUIPE 2;Remplacement ampoule;0:30;remplacement ampoule;non;oui;non;non;non;non;non;non;non;non;non;remplacement ampoule
44909407;A valider;;Eclairage public;Curatif Point Lumineux;QUIMPER;RUE JEANNE D'ARC;Luminaire;K808_1;;480.0;;24/11/2025;CITEOS QUIMPER;2025-11-24;CITEOS_EQUIPE 2;Remplacement ampoule;0:30;remplacement ampoule;non;oui;non;non;non;non;non;non;non;non;non;remplacement ampoule
44909405;A valider;;Eclairage public;Curatif Point Lumineux;QUIMPER;RUE JACQUELINE DOMERGUE;Luminaire;K818_1;;480.0;;24/11/2025;CITEOS QUIMPER;2025-11-24;CITEOS_EQUIPE 2;Remplacement fusible 4A;0:30;remplacement fusible 4a;oui;non;non;non;non;non;non;non;non;non;non;remplacement fusible
44909403;A valider;;Eclairage public;Curatif Point Lumineux;QUIMPER;PLACE GUY ROPARTZ;Luminaire;K2047;;480.0;;24/11/2025;CITEOS QUIMPER;2025-11-24;CITEOS_EQUIPE 2;Remplacement surtenseur;0:45;remplacement surtenseur;non;non;non;non;non;non;non;non;non;non;non;aucune opération détectée
44909401;A valider;;Eclairage public;Curatif Point Lumineux;QUIMPER;PLACE GUY ROPARTZ;Luminaire;K1382_1;;480.0;;24/11/2025;CITEOS QUIMPER;2025-11-24;CITEOS_EQUIPE 2;Remplacement surtenseur;0:45;remplacement surtenseur;non;non;non;non;non;non;non;non;non;non;non;aucune opération détectée
44909399;A valider;;Eclairage public;Curatif Point Lumineux;QUIMPER;PLACE GUY ROPARTZ;Luminaire;K1382_1;;480.0;;24/11/2025;CITEOS QUIMPER;2025-11-24;CITEOS_EQUIPE 2;Remplacement surtenseur;0:45;remplacement surtenseur;non;non;non;non;non;non;non;non;non;non;non;aucune opération détectée
44909397;A valider;;Eclairage public;Curatif Point Lumineux;QUIMPER;PLACE GUY ROPARTZ;Luminaire;K2046;;480.0;;24/11/2025;CITEOS QUIMPER;2025-11-24;CITEOS_EQUIPE 2;Remplacement surtenseur et fusible 4A;0:45;remplacement surtenseur et fusible 4a;oui;non;non;non;non;non;non;non;non;non;non;remplacement fusible
44909395;A valider;;Eclairage public;Curatif Point Lumineux;QUIMPER;PLACE GUY ROPARTZ;Luminaire;K2046;;480.0;;24/11/2025;CITEOS QUIMPER;2025-11-24;CITEOS_EQUIPE 2;Remplacement parafoudre et fusible 4A;0:45;remplacement parafoudre et fusible 4a;oui;non;non;non;non;non;non;non;non;non;non;remplacement fusible
44909393;A valider;;Eclairage public;Curatif Point Lumineux;QUIMPER;RUE CHARLES GOUNOD;Luminaire;K1787_1;;480.0;;24/11/2025;CITEOS QUIMPER;2025-11-24;CITEOS_EQUIPE 2;Remplacement fusible 2A;0:30;remplacement fusible 2a;oui;non;non;non;non;non;non;non;non;non;non;remplacement fusible
44909391;A valider;;Eclairage public;Curatif Point Lumineux;QUIMPER;RUE CHARLES GOUNOD;Luminaire;K1787_1;;480.0;;24/11/2025;CITEOS QUIMPER;2025-11-24;CITEOS_EQUIPE 2;Remplacement fusible 2A;0:30;remplacement fusible 2a;oui;non;non;non;non;non;non;non;non;non;non;remplacement fusible
44909389;A valider;;Eclairage public;Curatif Point Lumineux;QUIMPER;AVENUE DES SPORTS;Luminaire;K1226_1;;480.0;;24/11/2025;CITEOS QUIMPER;2025-11-24;CITEOS_EQUIPE 2;Remplacement driver;1:00;remplacement driver;non;non;oui;non;oui;non;non;non;non;non;non;remplacement driver, remplacement driver et connexions
44909387;A valider;;Eclairage public;Curatif Point Lumineux;QUIMPER;RUE YVES QUINQUIS;Luminaire;K1267_1;;480.0;;24/11/2025;CITEOS QUIMPER;2025-11-24;CITEOS_EQUIPE 2;Remplacement ampoule 100 W;0:30;remplacement ampoule 100 w;non;oui;non;non;non;non;non;non;non;non;non;remplacement ampoule
44909385;A valider;;Eclairage public;Curatif Point Lumineux;QUIMPER;RUE GUILLAUME BOUGEANT;Luminaire;E2386_1;12675.0;;;21/11/2025;CITEOS QUIMPER;2025-11-21;CITEOS_EQUIPE 2;;;;non;non;non;non;non;non;non;non;non;non;non;aucune opération détectée
44909383;A valider;;Eclairage public;Curatif Point Lumineux;QUIMPER;RUE CHARLES CHASSE;Luminaire;K444_1;12673.0;;;21/11/2025;CITEOS QUIMPER;2025-11-21;CITEOS_EQUIPE 2;RAS;;ras;non;non;non;non;non;non;non;non;non;non;non;aucune opération détectée
44909381;A valider;;Eclairage public;Curatif Armoire;QUIMPER;RUE ELIE FRERON;Armoire;78;12669.0;;;21/11/2025;CITEOS QUIMPER;2025-11-21;CITEOS_EQUIPE 2;RAS, tout fonctionne, horloge à l'heure réglée en permanent;;ras, tout fonctionne, horloge à l'heure réglée en permanent;non;non;non;non;non;non;non;non;non;non;non;aucune opération détectée
44909379;A valider;;Eclairage public;Curatif Point Lumineux;QUIMPER;RUE LOUIS PASTEUR;Luminaire;E2691_1;12667.0;;;21/11/2025;CITEOS QUIMPER;2025-11-21;CITEOS_EQUIPE 2;Reconnection du neutre sur le driver, essai ok;;reconnection du neutre sur le driver, essai ok;non;non;oui;non;oui;non;non;non;non;non;non;remplacement driver, remplacement driver et connexions
44909377;A valider;;Eclairage public;Curatif Point Lumineux;QUIMPER;RUE LE DEAN;Luminaire;C567_1;12665.0;;;21/11/2025;CITEOS QUIMPER;2025-11-21;CITEOS_EQUIPE 2;RAS, tout fonctionne normalement, vérification de l'horloge ok;;ras, tout fonctionne normalement, vérification de l'horloge ok;non;non;non;non;non;non;non;non;non;non;non;aucune opération détectée
44909375;A valider;;Eclairage public;Curatif Point Lumineux;QUIMPER;AVENUE DES CHASSEURS;Luminaire;K1938;;480.0;;21/11/2025;CITEOS QUIMPER;2025-11-21;CITEOS_EQUIPE 2;;;;non;non;non;non;non;non;non;non;non;non;non;aucune opération détectée
44909373;A valider;;Eclairage public;Curatif Point Lumineux;QUIMPER;ALLEE DE MEILH STANG VIHAN;Luminaire;K2006;;480.0;;21/11/2025;CITEOS QUIMPER;2025-11-21;CITEOS_EQUIPE 2;;;;non;non;non;non;non;non;non;non;non;non;non;aucune opération détectée
44909371;A valider;;Eclairage public;Curatif Point Lumineux;QUIMPER;RUE JAKEZ RIOU;Luminaire;K192_1;;480.0;;20/11/2025;CITEOS QUIMPER;2025-11-20;CITEOS_EQUIPE 1;Travaux en cour. Suite à l 'effacement de réseau  nu au profit du torsadé, les luminaires n'ont pas été raccordé.Faire intervenir l 'entreprise ayant réalisé  les travaux.;;travaux en cour. suite à l 'effacement de réseau  nu au profit du torsadé, les luminaires n'ont pas été raccordé.faire intervenir l 'entreprise ayant réalisé  les travaux.;non;non;non;non;non;non;non;non;non;non;non;aucune opération détectée
44909369;A valider;;Eclairage public;Curatif Point Lumineux;QUIMPER;RUE JAKEZ RIOU;Luminaire;K191_1;;480.0;;20/11/2025;CITEOS QUIMPER;2025-11-20;CITEOS_EQUIPE 1;Travaux en cour. Suite à l 'effacement de réseau  nu au profit du torsadé, les luminaires n'ont pas été raccordé.Faire intervenir l 'entreprise ayant réalisé  les travaux.;;travaux en cour. suite à l 'effacement de réseau  nu au profit du torsadé, les luminaires n'ont pas été raccordé.faire intervenir l 'entreprise ayant réalisé  les travaux.;non;non;non;non;non;non;non;non;non;non;non;aucune opération détectée
44909367;A valider;;Eclairage public;Curatif Point Lumineux;QUIMPER;RUE JAKEZ RIOU;Luminaire;K190_1;;480.0;;20/11/2025;CITEOS QUIMPER;2025-11-20;CITEOS_EQUIPE 1;Travaux en cour. Suite à l 'effacement de réseau  nu au profit du torsadé, les luminaires n'ont pas été raccordé.Faire intervenir l 'entreprise ayant réalisé  les travaux.;;travaux en cour. suite à l 'effacement de réseau  nu au profit du torsadé, les luminaires n'ont pas été raccordé.faire intervenir l 'entreprise ayant réalisé  les travaux.;non;non;non;non;non;non;non;non;non;non;non;aucune opération détectée
44909365;A valider;;Eclairage public;Curatif Point Lumineux;QUIMPER;RUE DES ROSES;Luminaire;K189_1;;480.0;;20/11/2025;CITEOS QUIMPER;2025-11-20;CITEOS_EQUIPE 1;Travaux en cour. Suite à l 'effacement de réseau  nu au profit du torsadé, les luminaires n'ont pas été raccordé.Faire intervenir l 'entreprise ayant réalisé  les travaux.;;travaux en cour. suite à l 'effacement de réseau  nu au profit du torsadé, les luminaires n'ont pas été raccordé.faire intervenir l 'entreprise ayant réalisé  les travaux.;non;non;non;non;non;non;non;non;non;non;non;aucune opération détectée
44909363;A valider;;Eclairage public;Curatif Point Lumineux;QUIMPER;RUE DES ROSES;Luminaire;K186_1;;480.0;;20/11/2025;CITEOS QUIMPER;2025-11-20;CITEOS_EQUIPE 1;Travaux en cour. Suite à l 'effacement de réseau  nu au profit du torsadé, les luminaires n'ont pas été raccordé.Faire intervenir l 'entreprise ayant réalisé  les travaux.;;travaux en cour. suite à l 'effacement de réseau  nu au profit du torsadé, les luminaires n'ont pas été raccordé.faire intervenir l 'entreprise ayant réalisé  les travaux.;non;non;non;non;non;non;non;non;non;non;non;aucune opération détectée
44909361;A valider;;Eclairage public;Curatif Point Lumineux;QUIMPER;RUE DES ROSES;Luminaire;K187_1;;480.0;;20/11/2025;CITEOS QUIMPER;2025-11-20;CITEOS_EQUIPE 1;Travaux en cour. Suite à l 'effacement de réseau  nu au profit du torsadé, les luminaires n'ont pas été raccordé.Faire intervenir l 'entreprise ayant réalisé  les travaux.;;travaux en cour. suite à l 'effacement de réseau  nu au profit du torsadé, les luminaires n'ont pas été raccordé.faire intervenir l 'entreprise ayant réalisé  les travaux.;non;non;non;non;non;non;non;non;non;non;non;aucune opération détectée
44909359;A valider;;Eclairage public;Curatif Point Lumineux;QUIMPER;RUE DOCTEUR PICQUENARD;Luminaire;K1200_1;;480.0;;20/11/2025;CITEOS QUIMPER;2025-11-20;CITEOS_EQUIPE 1;Luminaires paleo  leds HS .A remplacer.;;luminaires paleo  leds hs .a remplacer.;non;non;non;non;non;non;non;oui;non;non;non;plateau led hs
44909357;A valider;;Eclairage public;Curatif Point Lumineux;QUIMPER;RUE DOCTEUR PICQUENARD;Luminaire;K1198_1;;480.0;;20/11/2025;CITEOS QUIMPER;2025-11-20;CITEOS_EQUIPE 1;Luminaires paleo  leds HS .A remplacer.;;luminaires paleo  leds hs .a remplacer.;non;non;non;non;non;non;non;oui;non;non;non;plateau led hs
44909355;A valider;;Eclairage public;Curatif Point Lumineux;QUIMPER;RUE DOCTEUR PICQUENARD;Luminaire;K1193_1;;480.0;;20/11/2025;CITEOS QUIMPER;2025-11-20;CITEOS_EQUIPE 1;Luminaires paleo  leds HS .A remplacer.;;luminaires paleo  leds hs .a remplacer.;non;non;non;non;non;non;non;oui;non;non;non;plateau led hs
44909353;A valider;;Eclairage public;Curatif Point Lumineux;QUIMPER;ROUTE DE BREST;Luminaire;K919_1;;480.0;;20/11/2025;CITEOS QUIMPER;2025-11-20;CITEOS_EQUIPE 1;Luminaire leds axia  2.2 hs .Prévoir remplacement du Luminaire.;;luminaire leds axia  2.2 hs .prévoir remplacement du luminaire.;non;non;non;non;non;non;non;oui;non;non;non;plateau led hs
44909351;A valider;;Eclairage public;Curatif Point Lumineux;QUIMPER;ROUTE DE BREST;Luminaire;K915_1;;480.0;;20/11/2025;CITEOS QUIMPER;2025-11-20;CITEOS_EQUIPE 1;Mat et luminaire deja déposé et cône jaune de balisage et de sécurité électrique mis en place.;;mat et luminaire deja déposé et cône jaune de balisage et de sécurité électrique mis en place.;non;non;non;non;non;non;non;non;non;non;non;aucune opération détectée
44909349;A valider;;Eclairage public;Curatif Point Lumineux;QUIMPER;VIEILLE ROUTE DE ROSPORDEN;Luminaire;E576_1;12663.0;;;20/11/2025;CITEOS QUIMPER;2025-11-19;CITEOS_EQUIPE 1;Oublie de raccordements  des points lumineux sur le réseau torsadé après effacement du réseau nu .Pose d1m de torsadé  ,1 connecteur à  anneau et un TTD151.;0:40;oublie de raccordements  des points lumineux sur le réseau torsadé après effacement du réseau nu .pose d1m de torsadé  ,1 connecteur à  anneau et un ttd151.;non;non;non;non;oui;non;non;non;non;non;oui;remplacement driver et connexions, refection connexions
44909347;A valider;;Eclairage public;Curatif Point Lumineux;QUIMPER;VIEILLE ROUTE DE ROSPORDEN;Luminaire;E577_1;12663.0;;;20/11/2025;CITEOS QUIMPER;2025-11-19;CITEOS_EQUIPE 1;Oublie de raccordements  des points lumineux sur le réseau torsadé après effacement du réseau nu .Pose d1m de torsadé  ,1 connecteur à  anneau et un TTD151.;0:40;oublie de raccordements  des points lumineux sur le réseau torsadé après effacement du réseau nu .pose d1m de torsadé  ,1 connecteur à  anneau et un ttd151.;non;non;non;non;oui;non;non;non;non;non;oui;remplacement driver et connexions, refection connexions
44909345;A valider;;Eclairage public;Curatif Point Lumineux;QUIMPER;VIEILLE ROUTE DE ROSPORDEN;Luminaire;E578_1;12663.0;;;20/11/2025;CITEOS QUIMPER;2025-11-19;CITEOS_EQUIPE 1;Oublie de raccordements  des points lumineux sur le réseau torsadé après effacement du réseau nu .Pose d1m de torsadé  ,1 connecteur à  anneau et un TTD151.;0:40;oublie de raccordements  des points lumineux sur le réseau torsadé après effacement du réseau nu .pose d1m de torsadé  ,1 connecteur à  anneau et un ttd151.;non;non;non;non;oui;non;non;non;non;non;oui;remplacement driver et connexions, refection connexions
44909343;A valider;;Eclairage public;Curatif Point Lumineux;QUIMPER;RUE DES VIOLETTES;Luminaire;K180_1;;480.0;;19/11/2025;CITEOS QUIMPER;2025-11-19;CITEOS_EQUIPE 2;Remplacement des connecteurs sur câble d?alimentation;1:00;remplacement des connecteurs sur câble d?alimentation;non;non;non;non;non;non;oui;non;non;non;non;separation phases cablage
44909341;A valider;;Eclairage public;Curatif Point Lumineux;QUIMPER;VIEILLE ROUTE DE ROSPORDEN;Luminaire;E2915_1;12663.0;;;19/11/2025;CITEOS QUIMPER;2025-11-19;CITEOS_EQUIPE 1;Ras le point lumineux fonctionne.;;ras le point lumineux fonctionne.;non;non;non;non;non;non;non;non;non;non;non;aucune opération détectée
44909339;A valider;;Eclairage public;Curatif Point Lumineux;QUIMPER;RUE CHARLES CHASSE;Luminaire;K444_1;12649.0;;;19/11/2025;CITEOS QUIMPER;2025-11-19;CITEOS_EQUIPE 2;Remplacement fusible 2A;0:30;remplacement fusible 2a;oui;non;non;non;non;non;non;non;non;non;non;remplacement fusible
44909337;A valider;;Eclairage public;Curatif Point Lumineux;QUIMPER;RUE CHARLES GOUNOD;Luminaire;K1787_1;12661.0;;;19/11/2025;CITEOS QUIMPER;2025-11-19;CITEOS_EQUIPE 1;Changement de driver 150w 0,2-0,7A ampdim et Changement de boîtier classe 2 PBA .Essais ok;1:00;changement de driver 150w 0,2-0,7a ampdim et changement de boîtier classe 2 pba .essais ok;non;oui;oui;non;oui;non;non;non;non;non;non;remplacement ampoule, remplacement driver, remplacement driver et connexions
44909335;A valider;;Eclairage public;Curatif Point Lumineux;QUIMPER;AVENUE DES GLENAN;Luminaire;P1461_1;;476.0;;19/11/2025;CITEOS QUIMPER;2025-11-19;CITEOS_EQUIPE 2;Remplacement ampoule 150 W;0:30;remplacement ampoule 150 w;non;oui;non;non;non;non;non;non;non;non;non;remplacement ampoule
44909333;A valider;;Eclairage public;Curatif Point Lumineux;QUIMPER;BOULEVARD DE FRANCE;Luminaire;P2390_1;;476.0;;19/11/2025;CITEOS QUIMPER;2025-11-19;CITEOS_EQUIPE 2;Remplacement fusible 2A;0:30;remplacement fusible 2a;oui;non;non;non;non;non;non;non;non;non;non;remplacement fusible
44909331;A valider;;Eclairage public;Curatif Point Lumineux;QUIMPER;RUE CHARLES GOUNOD;Luminaire;K849_1;12661.0;;;19/11/2025;CITEOS QUIMPER;2025-11-19;CITEOS_EQUIPE 1;Refixation boîtier classe 2 sur pba;;refixation boîtier classe 2 sur pba;non;non;non;non;non;non;non;non;non;non;non;aucune opération détectée
44909329;A valider;;Eclairage public;Curatif Point Lumineux;QUIMPER;RUE CHARLES GOUNOD;Luminaire;K850_1;12661.0;;;19/11/2025;CITEOS QUIMPER;2025-11-19;CITEOS_EQUIPE 1;RAS le point lumineux fonctionne..;0:30;ras le point lumineux fonctionne..;non;non;non;non;non;non;non;non;non;non;non;aucune opération détectée
44909327;A valider;;Eclairage public;Curatif Point Lumineux;QUIMPER;RUE PAUL BORROSSI;Luminaire;P363_1;;476.0;;19/11/2025;CITEOS QUIMPER;2025-11-19;CITEOS_EQUIPE 2;Absence d?ouvrage;0:15;absence d?ouvrage;non;non;non;non;non;non;non;non;non;non;non;aucune opération détectée
44909325;A valider;;Eclairage public;Curatif Point Lumineux;QUIMPER;RUE PAUL BORROSSI;Luminaire;P363_1;;476.0;;19/11/2025;CITEOS QUIMPER;2025-11-19;CITEOS_EQUIPE 2;Absence d?ouvrage;0:15;absence d?ouvrage;non;non;non;non;non;non;non;non;non;non;non;aucune opération détectée
44909323;A valider;;Eclairage public;Curatif Point Lumineux;QUIMPER;AVENUE DE BECHARLES;Luminaire;K2072;;480.0;;19/11/2025;CITEOS QUIMPER;2025-11-19;CITEOS_EQUIPE 1;Luminaires et crosse double déposés suite à  un sinistre. Prévoir leurs remplacements .;;luminaires et crosse double déposés suite à  un sinistre. prévoir leurs remplacements .;non;non;non;non;non;non;non;non;non;non;non;aucune opération détectée
44909321;A valider;;Eclairage public;Curatif Point Lumineux;QUIMPER;AVENUE DE BECHARLES;Luminaire;K2072_2;;480.0;;19/11/2025;CITEOS QUIMPER;2025-11-19;CITEOS_EQUIPE 1;Luminaires et crosse double déposés suite à  un sinistre. Prévoir leurs remplacements .;;luminaires et crosse double déposés suite à  un sinistre. prévoir leurs remplacements .;non;non;non;non;non;non;non;non;non;non;non;aucune opération détectée
44909319;A valider;;Eclairage public;Curatif Point Lumineux;QUIMPER;AVENUE DE BECHARLES;Luminaire;K1757_1;;480.0;;19/11/2025;CITEOS QUIMPER;2025-11-19;CITEOS_EQUIPE 1;Plus de luminaire sur le mât. Prévoir pose lanterne.;;plus de luminaire sur le mât. prévoir pose lanterne.;non;non;non;non;non;oui;non;non;non;non;non;pose lanterne provisoire
44909317;Validé;;Eclairage public;Curatif Point Lumineux;QUIMPER;ALLEE DE KERMOGUER;Luminaire;K409_1;;480.0;;19/11/2025;CITEOS QUIMPER;2025-11-19;CITEOS_EQUIPE 1;Cône jaune à  la place du mât. Il faudra reposer 1 mât et une lanterne.;;cône jaune à  la place du mât. il faudra reposer 1 mât et une lanterne.;non;non;non;non;non;oui;non;non;non;non;non;pose lanterne provisoire
44909315;Validé;;Eclairage public;Curatif Point Lumineux;QUIMPER;CHEMIN DE L'EGLANTINE;Luminaire;K948_1;;480.0;;19/11/2025;CITEOS QUIMPER;2025-11-19;CITEOS_EQUIPE 1;Plus d'alimentation réseau depuis la tempête. Il faudra retirer une portée de torsadé pour realimenter le point lumineux.;;plus d'alimentation réseau depuis la tempête. il faudra retirer une portée de torsadé pour realimenter le point lumineux.;non;non;non;non;non;non;oui;non;non;non;non;separation phases cablage
44909313;A valider;;Eclairage public;Curatif Point Lumineux;QUIMPER;RUE DE KEROMNES;Luminaire;E379_1;12647.0;;;19/11/2025;CITEOS QUIMPER;2025-11-19;CITEOS_EQUIPE 1;Luminaire leds axia 2.2 HS .A remplacer.;;luminaire leds axia 2.2 hs .a remplacer.;non;non;non;non;non;non;non;oui;non;non;non;plateau led hs
44909311;A valider;;Eclairage public;Curatif Point Lumineux;QUIMPER;PLACE DE LA RESISTANCE ET DU GENERAL DE GAULLE;Luminaire;C422_2;12651.0;;;19/11/2025;CITEOS QUIMPER;2025-11-19;CITEOS_EQUIPE 1;Ras Vérification de bon fonctionnement ok.L'ensemble des points lumineux fonctionnent.Essais okk;1:00;ras vérification de bon fonctionnement ok.l'ensemble des points lumineux fonctionnent.essais okk;non;non;non;non;non;non;non;non;non;non;non;aucune opération détectée
44909309;A valider;;Eclairage public;Curatif Armoire;QUIMPER;RUE COMMANDANT AVRIL;Armoire;111;;;;19/11/2025;CITEOS QUIMPER;2025-11-19;CITEOS_EQUIPE 1;Changement de contacteur 40A mono .En effet 1 des 2 contacteurs vibrait anormalement et n'aurait pas tardé  à  lâcher. Essais ok.;1:00;changement de contacteur 40a mono .en effet 1 des 2 contacteurs vibrait anormalement et n'aurait pas tardé  à  lâcher. essais ok.;non;non;non;non;non;non;non;non;non;non;non;aucune opération détectée
44909307;A valider;;Eclairage public;Curatif Point Lumineux;QUIMPER;RUE JEAN-BAPTISTE BOUSQUET;Luminaire;E2522_1;12617.0;;;19/11/2025;CITEOS QUIMPER;2025-11-19;CITEOS_EQUIPE 1;Changement de driver 75w 0,2-0,7 A ampdim .Essais ok.;1:00;changement de driver 75w 0,2-0,7 a ampdim .essais ok.;non;non;oui;non;oui;non;non;non;non;non;non;remplacement driver, remplacement driver et connexions
44909305;A valider;;Eclairage public;Curatif Point Lumineux;QUIMPER;RUE JEAN-BAPTISTE BOUSQUET;Luminaire;E2521_1;12617.0;;;19/11/2025;CITEOS QUIMPER;2025-11-19;CITEOS_EQUIPE 1;Ras le point lumineux fonctionne.;0:30;ras le point lumineux fonctionne.;non;non;non;non;non;non;non;non;non;non;non;aucune opération détectée
44909303;A valider;;Eclairage public;Curatif Armoire;QUIMPER;ROUTE DE KEROGAN;Armoire;424;12643.0;;;19/11/2025;CITEOS QUIMPER;2025-11-17;CITEOS_EQUIPE 1;Changement d'horloge de commande. Horaires 23h - 6h . Essais ok;16:39;changement d'horloge de commande. horaires 23h - 6h . essais ok;non;non;non;non;non;non;non;non;non;non;non;aucune opération détectée
44909301;A valider;;Eclairage public;Curatif Point Lumineux;QUIMPER;AVENUE DE TI PONT;Luminaire;K2095;12657.0;;;18/11/2025;CITEOS QUIMPER;2025-11-18;CITEOS_EQUIPE 2;Essais de fonctionnement pendant 15 minutes ras;0:15;essais de fonctionnement pendant 15 minutes ras;non;non;non;non;non;non;non;non;non;non;non;aucune opération détectée
44909299;A valider;;Eclairage public;Curatif Point Lumineux;QUIMPER;;Luminaire;X:171701.6347816 Y: 6788459.7507393;;;;18/11/2025;CITEOS QUIMPER;2025-11-18;CITEOS_EQUIPE 1;;0:30;;non;non;non;non;non;non;non;non;non;non;non;aucune opération détectée
44909297;A valider;;Eclairage public;Curatif Point Lumineux;QUIMPER;RUE DE LA PRAIRIE;Luminaire;P1468_1;12659.0;;;18/11/2025;CITEOS QUIMPER;2025-11-18;CITEOS_EQUIPE 2;Essais de fonctionnement  pendant 15 minutes ras;0:15;essais de fonctionnement  pendant 15 minutes ras;non;non;non;non;non;non;non;non;non;non;non;aucune opération détectée
44909295;A valider;;Eclairage public;Curatif Point Lumineux;QUIMPER;RUE DE LA PRAIRIE;Luminaire;P1468_1;12659.0;;;18/11/2025;CITEOS QUIMPER;2025-11-18;CITEOS_EQUIPE 2;Essais de fonctionnement  15 minutes ras;0:15;essais de fonctionnement  15 minutes ras;non;non;non;non;non;non;non;non;non;non;non;aucune opération détectée
44909293;A valider;;Eclairage public;Curatif Point Lumineux;QUIMPER;RUE SAINT POL ROUX;Luminaire;E2069_1;12653.0;;;18/11/2025;CITEOS QUIMPER;2025-11-18;CITEOS_EQUIPE 2;Essais de fonctionnement pendant 15 minutes ras;0:15;essais de fonctionnement pendant 15 minutes ras;non;non;non;non;non;non;non;non;non;non;non;aucune opération détectée
44909291;A valider;;Eclairage public;Curatif Point Lumineux;QUIMPER;RUE SAINT POL ROUX;Luminaire;E2072_1;12655.0;;;18/11/2025;CITEOS QUIMPER;2025-11-18;CITEOS_EQUIPE 2;Essais de fonctionnement pdt 15 minutes ras;0:15;essais de fonctionnement pdt 15 minutes ras;non;non;non;non;non;non;non;non;non;non;non;aucune opération détectée
44909289;A valider;;Eclairage public;Curatif Point Lumineux;QUIMPER;RUE DE TAHITI;Luminaire;E1501_1;12645.0;;;18/11/2025;CITEOS QUIMPER;2025-11-18;CITEOS_EQUIPE 1;Pose ballast ferro amorceur lampe;1:00;pose ballast ferro amorceur lampe;non;oui;oui;non;non;non;non;non;non;non;non;remplacement ampoule, remplacement driver
44909287;A valider;;Eclairage public;Curatif Point Lumineux;QUIMPER;ROUTE DE PLOMELIN;Luminaire;P127_1;;476.0;;17/11/2025;CITEOS QUIMPER;2025-11-17;CITEOS_EQUIPE 1;Ls de câble d'alimentation réseau.....câble accroché ???;0:45;ls de câble d'alimentation réseau.....câble accroché ???;non;non;non;non;non;non;oui;non;non;non;non;separation phases cablage
44909285;A valider;;Eclairage public;Curatif Point Lumineux;QUIMPER;AVENUE PIERRE MENDES-FRANCE;Luminaire;P165_1;;476.0;;17/11/2025;CITEOS QUIMPER;2025-11-17;CITEOS_EQUIPE 1;Changement de lampe 150w  shp .Essais ok.;0:45;changement de lampe 150w  shp .essais ok.;non;oui;non;non;non;non;non;non;non;non;non;remplacement ampoule
44909283;A valider;;Eclairage public;Curatif Point Lumineux;QUIMPER;RUE DE KERGESTIN;Luminaire;P870_1;;476.0;;17/11/2025;CITEOS QUIMPER;2025-11-17;CITEOS_EQUIPE 1;Plus de luminasur le mât. Prévoir luminaire leds neuf.;0:30;plus de luminasur le mât. prévoir luminaire leds neuf.;non;non;non;non;non;non;non;non;non;non;non;aucune opération détectée
44909281;A valider;;Eclairage public;Curatif Point Lumineux;QUIMPER;ALLEE DE PRAT AR ROZ;Luminaire;P1053_1;;;;17/11/2025;CITEOS QUIMPER;2025-11-17;CITEOS_EQUIPE 1;Changement de lampe 100w cdo tt et Changement d'amorceur. Essais ok;1:00;changement de lampe 100w cdo tt et changement d'amorceur. essais ok;non;oui;non;non;non;non;non;non;non;non;non;remplacement ampoule
44909279;A valider;;Eclairage public;Curatif Point Lumineux;QUIMPER;ALLEE DE PRAT AR ROZ;Luminaire;P1056_3;12547.0;;;17/11/2025;CITEOS QUIMPER;2025-11-17;CITEOS_EQUIPE 1;Changement de lampe 70w cdm t 830 et de ballast électronique  70w.Essais ok.;0:30;changement de lampe 70w cdm t 830 et de ballast électronique  70w.essais ok.;non;oui;oui;non;non;non;non;non;non;non;non;remplacement ampoule, remplacement driver
44909277;A valider;;Eclairage public;Curatif Point Lumineux;QUIMPER;ALLEE DE PRAT AR ROZ;Luminaire;P1056_1;12547.0;;;17/11/2025;CITEOS QUIMPER;2025-11-17;CITEOS_EQUIPE 1;Changement de lampe 70w cdm t 830 et de ballast électronique  70w.Essais ok.;0:30;changement de lampe 70w cdm t 830 et de ballast électronique  70w.essais ok.;non;oui;oui;non;non;non;non;non;non;non;non;remplacement ampoule, remplacement driver
44909275;A valider;;Eclairage public;Curatif Point Lumineux;QUIMPER;ALLEE DE PRAT AR ROZ;Luminaire;P1056_4;12547.0;;;17/11/2025;CITEOS QUIMPER;2025-11-17;CITEOS_EQUIPE 1;Changement de lampe  70w cdm t.Essais ok.;0:30;changement de lampe  70w cdm t.essais ok.;non;oui;non;non;non;non;non;non;non;non;non;remplacement ampoule
44909273;A valider;;Eclairage public;Curatif Point Lumineux;QUIMPER;ALLEE DE PRAT AR ROZ;Luminaire;P1056_2;12547.0;;;17/11/2025;CITEOS QUIMPER;2025-11-17;CITEOS_EQUIPE 1;Changement de lampe  70w cdm t.Essais ok.;0:30;changement de lampe  70w cdm t.essais ok.;non;oui;non;non;non;non;non;non;non;non;non;remplacement ampoule
44909271;A valider;;Eclairage public;Curatif Point Lumineux;QUIMPER;RUE ANATOLE FRANCE;Luminaire;E2102_1;12519.0;;;17/11/2025;CITEOS QUIMPER;2025-11-17;CITEOS_EQUIPE 1;Changement de driver 40w 0,2-0,7A ampdim .Essais ok;1:00;changement de driver 40w 0,2-0,7a ampdim .essais ok;non;non;oui;non;oui;non;non;non;non;non;non;remplacement driver, remplacement driver et connexions
44909269;A valider;;Eclairage public;Curatif Point Lumineux;QUIMPER;RUE DE SILGUY;Luminaire;C356_1;;;;17/11/2025;CITEOS QUIMPER;2025-11-17;CITEOS_EQUIPE 1;Changement de lampe 70w cdo tt .Essais OK.;1:00;changement de lampe 70w cdo tt .essais ok.;non;oui;non;non;non;non;non;non;non;non;non;remplacement ampoule
44909267;A valider;;Eclairage public;Curatif Point Lumineux;QUIMPER;RUE DE LA PALESTINE;Luminaire;C383_1;12541.0;;;17/11/2025;CITEOS QUIMPER;2025-11-17;CITEOS_EQUIPE 1;RAS le point lumineux leds fonctionne.;0:45;ras le point lumineux leds fonctionne.;non;non;non;non;non;non;non;non;non;non;non;aucune opération détectée
44909265;A valider;;Eclairage public;Curatif Point Lumineux;QUIMPER;RUE DE SILGUY;Luminaire;C356_1;12539.0;;;17/11/2025;CITEOS QUIMPER;2025-11-17;CITEOS_EQUIPE 1;RAS Le point lumineux fonctionne.;0:45;ras le point lumineux fonctionne.;non;non;non;non;non;non;non;non;non;non;non;aucune opération détectée
44909263;A valider;;Eclairage public;Curatif Point Lumineux;QUIMPER;RUE DE LA PROVIDENCE;Luminaire;C230_1;12545.0;;;17/11/2025;CITEOS QUIMPER;2025-11-17;CITEOS_EQUIPE 1;Changement de lampe 150w cdo tt ,de ballast 150w ,d 'amorceur  et de porte fusible. Essais ok;1:30;changement de lampe 150w cdo tt ,de ballast 150w ,d 'amorceur  et de porte fusible. essais ok;oui;oui;oui;non;non;non;non;non;non;non;non;remplacement fusible, remplacement ampoule, remplacement driver
44909261;A valider;;Eclairage public;Curatif Point Lumineux;QUIMPER;RUE DE LA PROVIDENCE;Luminaire;C229_1;12545.0;;;17/11/2025;CITEOS QUIMPER;2025-11-17;CITEOS_EQUIPE 1;Changement de lampe 150 w cdo tt .Essais OK;1:00;changement de lampe 150 w cdo tt .essais ok;non;oui;non;non;non;non;non;non;non;non;non;remplacement ampoule
44909259;A valider;;Eclairage public;Curatif Point Lumineux;QUIMPER;PARC DE LA PROVIDENCE;Luminaire;P3028;;476.0;;17/11/2025;CITEOS QUIMPER;2025-11-17;CITEOS_EQUIPE 1;Changement de lampe 150w  shp .Essais ok.;1:00;changement de lampe 150w  shp .essais ok.;non;oui;non;non;non;non;non;non;non;non;non;remplacement ampoule
44909257;A valider;;Eclairage public;Curatif Armoire;QUIMPER;ROUTE DE KEROGAN;Armoire;424;12621.0;;;17/11/2025;VILLE DE QUIMPER;2025-11-14;CITEOS_EQUIPE 2;Coupure générale du quartier (ENEDIS);1:00;coupure générale du quartier (enedis);non;non;non;non;non;non;non;non;non;non;non;aucune opération détectée
44909255;Validé;;Eclairage public;Tournée de nuit luminaire;QUIMPER;AVENUE DES CHASSEURS;Luminaire;K1938;;477.0;;15/11/2025;CITEOS QUIMPER;2025-11-15;;;;;non;non;non;non;non;non;non;non;non;non;non;aucune opération détectée
44909253;Validé;;Eclairage public;Tournée de nuit luminaire;QUIMPER;ALLEE DE MEILH STANG VIHAN;Luminaire;K2006;;477.0;;15/11/2025;CITEOS QUIMPER;2025-11-15;;;;;non;non;non;non;non;non;non;non;non;non;non;aucune opération détectée
44909251;Validé;;Eclairage public;Tournée de nuit luminaire;QUIMPER;PLACE DE LA CROIX DES GARDIENS;Luminaire;K2052_2;;477.0;;15/11/2025;CITEOS QUIMPER;2025-11-15;;;;;non;non;non;non;non;non;non;non;non;non;non;aucune opération détectée
44909249;Validé;;Eclairage public;Tournée de nuit luminaire;QUIMPER;RUE DE STANG BIHAN;Luminaire;K2065;;477.0;;15/11/2025;CITEOS QUIMPER;2025-11-15;;;;;non;non;non;non;non;non;non;non;non;non;non;aucune opération détectée
44909247;Validé;;Eclairage public;Tournée de nuit luminaire;QUIMPER;PLACE DE LA CROIX DES GARDIENS;Luminaire;K2054;;477.0;;15/11/2025;CITEOS QUIMPER;2025-11-15;;;;;non;non;non;non;non;non;non;non;non;non;non;aucune opération détectée
44909245;Validé;;Eclairage public;Tournée de nuit luminaire;QUIMPER;RUE JAKEZ RIOU;Luminaire;K192_1;;477.0;;15/11/2025;CITEOS QUIMPER;2025-11-15;;;;;non;non;non;non;non;non;non;non;non;non;non;aucune opération détectée
44909243;Validé;;Eclairage public;Tournée de nuit luminaire;QUIMPER;RUE JAKEZ RIOU;Luminaire;K191_1;;477.0;;15/11/2025;CITEOS QUIMPER;2025-11-15;;;;;non;non;non;non;non;non;non;non;non;non;non;aucune opération détectée
44909241;Validé;;Eclairage public;Tournée de nuit luminaire;QUIMPER;RUE JAKEZ RIOU;Luminaire;K190_1;;477.0;;15/11/2025;CITEOS QUIMPER;2025-11-15;;;;;non;non;non;non;non;non;non;non;non;non;non;aucune opération détectée
44909239;Validé;;Eclairage public;Tournée de nuit luminaire;QUIMPER;RUE DES ROSES;Luminaire;K189_1;;477.0;;15/11/2025;CITEOS QUIMPER;2025-11-15;;;;;non;non;non;non;non;non;non;non;non;non;non;aucune opération détectée
44909237;Validé;;Eclairage public;Tournée de nuit luminaire;QUIMPER;RUE DES ROSES;Luminaire;K187_1;;477.0;;15/11/2025;CITEOS QUIMPER;2025-11-15;;;;;non;non;non;non;non;non;non;non;non;non;non;aucune opération détectée
44909235;Validé;;Eclairage public;Tournée de nuit luminaire;QUIMPER;RUE DES ROSES;Luminaire;K186_1;;477.0;;15/11/2025;CITEOS QUIMPER;2025-11-15;;;;;non;non;non;non;non;non;non;non;non;non;non;aucune opération détectée
44909233;Validé;;Eclairage public;Tournée de nuit luminaire;QUIMPER;RUE DES VIOLETTES;Luminaire;K180_1;;477.0;;15/11/2025;CITEOS QUIMPER;2025-11-15;;;;;non;non;non;non;non;non;non;non;non;non;non;aucune opération détectée
44909231;Validé;;Eclairage public;Tournée de nuit luminaire;QUIMPER;RUE CHANOINE KERBRAT;Luminaire;K535_2;;477.0;;15/11/2025;CITEOS QUIMPER;2025-11-15;;;;;non;non;non;non;non;non;non;non;non;non;non;aucune opération détectée
44909229;Validé;;Eclairage public;Tournée de nuit luminaire;QUIMPER;RUE LEON JOUHAUX;Luminaire;K534_2;;477.0;;15/11/2025;CITEOS QUIMPER;2025-11-15;;;;;non;non;non;non;non;non;non;non;non;non;non;aucune opération détectée
44909227;Validé;;Eclairage public;Tournée de nuit luminaire;QUIMPER;RUE CLAUDE BERNARD;Luminaire;K241_1;;477.0;;15/11/2025;CITEOS QUIMPER;2025-11-15;;;;;non;non;non;non;non;non;non;non;non;non;non;aucune opération détectée
44909225;Validé;;Eclairage public;Tournée de nuit luminaire;QUIMPER;RUE CLAUDE BERNARD;Luminaire;K239_1;;477.0;;15/11/2025;CITEOS QUIMPER;2025-11-15;;;;;non;non;non;non;non;non;non;non;non;non;non;aucune opération détectée
44909223;Validé;;Eclairage public;Tournée de nuit luminaire;QUIMPER;RUE CLAUDE BERNARD;Luminaire;K240_1;;477.0;;15/11/2025;CITEOS QUIMPER;2025-11-15;;;;;non;non;non;non;non;non;non;non;non;non;non;aucune opération détectée
44909221;Validé;;Eclairage public;Tournée de nuit luminaire;QUIMPER;RUE DE LEURGUERIC;Luminaire;K610_1;;477.0;;15/11/2025;CITEOS QUIMPER;2025-11-15;;;;;non;non;non;non;non;non;non;non;non;non;non;aucune opération détectée
44909219;Validé;;Eclairage public;Tournée de nuit luminaire;QUIMPER;RUE JOSEPH LOTH;Luminaire;K2135;;477.0;;14/11/2025;CITEOS QUIMPER;2025-11-14;;;;;non;non;non;non;non;non;non;non;non;non;non;aucune opération détectée
44909217;Validé;;Eclairage public;Tournée de nuit luminaire;QUIMPER;LA VOIE ROMAINE;Luminaire;K1122_1;;477.0;;14/11/2025;CITEOS QUIMPER;2025-11-14;;;;;non;non;non;non;non;non;non;non;non;non;non;aucune opération détectée
44909215;Validé;;Eclairage public;Tournée de nuit luminaire;QUIMPER;LA VOIE ROMAINE;Luminaire;K1121_1;;477.0;;14/11/2025;CITEOS QUIMPER;2025-11-14;;;;;non;non;non;non;non;non;non;non;non;non;non;aucune opération détectée
44909213;Validé;;Eclairage public;Tournée de nuit luminaire;QUIMPER;LA VOIE ROMAINE;Luminaire;K1120_1;;477.0;;14/11/2025;CITEOS QUIMPER;2025-11-14;;;;;non;non;non;non;non;non;non;non;non;non;non;aucune opération détectée
44909211;Validé;;Eclairage public;Tournée de nuit luminaire;QUIMPER;BOULEVARD DES FRERES MAILLET;Luminaire;K773_1;;477.0;;14/11/2025;CITEOS QUIMPER;2025-11-14;;;;;non;non;non;non;non;non;non;non;non;non;non;aucune opération détectée
44909209;Validé;;Eclairage public;Tournée de nuit luminaire;QUIMPER;ALLEE DES QUATRE LE JEUNE;Luminaire;K1048_1;;477.0;;14/11/2025;CITEOS QUIMPER;2025-11-14;;;;;non;non;non;non;non;non;non;non;non;non;non;aucune opération détectée
44909207;Validé;;Eclairage public;Tournée de nuit luminaire;QUIMPER;ALLEE DES QUATRE LE JEUNE;Luminaire;K1047_1;;477.0;;14/11/2025;CITEOS QUIMPER;2025-11-14;;;;;non;non;non;non;non;non;non;non;non;non;non;aucune opération détectée
44909205;Validé;;Eclairage public;Tournée de nuit luminaire;QUIMPER;ALLEE DES QUATRE LE JEUNE;Luminaire;K1046_1;;477.0;;14/11/2025;CITEOS QUIMPER;2025-11-14;;;;;non;non;non;non;non;non;non;non;non;non;non;aucune opération détectée
44909203;Validé;;Eclairage public;Tournée de nuit luminaire;QUIMPER;ALLEE DES QUATRE LE JEUNE;Luminaire;K1045_1;;477.0;;14/11/2025;CITEOS QUIMPER;2025-11-14;;;;;non;non;non;non;non;non;non;non;non;non;non;aucune opération détectée
44909201;Validé;;Eclairage public;Tournée de nuit luminaire;QUIMPER;AVENUE DE GOURVILY;Luminaire;K1037_1;;477.0;;14/11/2025;CITEOS QUIMPER;2025-11-14;;;;;non;non;non;non;non;non;non;non;non;non;non;aucune opération détectée
44909199;Validé;;Eclairage public;Tournée de nuit luminaire;QUIMPER;AVENUE DE GOURVILY;Luminaire;K1039_1;;477.0;;14/11/2025;CITEOS QUIMPER;2025-11-14;;;;;non;non;non;non;non;non;non;non;non;non;non;aucune opération détectée
44909197;Validé;;Eclairage public;Tournée de nuit luminaire;QUIMPER;AVENUE DE GOURVILY;Luminaire;K1041_1;;477.0;;14/11/2025;CITEOS QUIMPER;2025-11-14;;;;;non;non;non;non;non;non;non;non;non;non;non;aucune opération détectée
44909195;Validé;;Eclairage public;Tournée de nuit luminaire;QUIMPER;AVENUE DE GOURVILY;Luminaire;K1040_1;;477.0;;14/11/2025;CITEOS QUIMPER;2025-11-14;;;;;non;non;non;non;non;non;non;non;non;non;non;aucune opération détectée
44909193;Validé;;Eclairage public;Tournée de nuit luminaire;QUIMPER;AVENUE DE GOURVILY;Luminaire;K1038_1;;477.0;;14/11/2025;CITEOS QUIMPER;2025-11-14;;;;;non;non;non;non;non;non;non;non;non;non;non;aucune opération détectée
44909191;Validé;;Eclairage public;Tournée de nuit luminaire;QUIMPER;ALLEE DES QUATRE LE JEUNE;Luminaire;K1044_1;;477.0;;14/11/2025;CITEOS QUIMPER;2025-11-14;;;;;non;non;non;non;non;non;non;non;non;non;non;aucune opération détectée
44909189;Validé;;Eclairage public;Tournée de nuit luminaire;QUIMPER;ALLEE DES QUATRE LE JEUNE;Luminaire;K1043_1;;477.0;;14/11/2025;CITEOS QUIMPER;2025-11-14;;;;;non;non;non;non;non;non;non;non;non;non;non;aucune opération détectée
44909187;Validé;;Eclairage public;Tournée de nuit luminaire;QUIMPER;AVENUE DE GOURVILY;Luminaire;K1033_1;;477.0;;14/11/2025;CITEOS QUIMPER;2025-11-14;;;;;non;non;non;non;non;non;non;non;non;non;non;aucune opération détectée
44909185;Validé;;Eclairage public;Tournée de nuit luminaire;QUIMPER;AVENUE DE GOURVILY;Luminaire;K1035_1;;477.0;;14/11/2025;CITEOS QUIMPER;2025-11-14;;;;;non;non;non;non;non;non;non;non;non;non;non;aucune opération détectée
44909183;Validé;;Eclairage public;Tournée de nuit luminaire;QUIMPER;AVENUE DE GOURVILY;Luminaire;K1036_1;;477.0;;14/11/2025;CITEOS QUIMPER;2025-11-14;;;;;non;non;non;non;non;non;non;non;non;non;non;aucune opération détectée
44909181;Validé;;Eclairage public;Tournée de nuit luminaire;QUIMPER;ROND POINT DES QUATRE LE JEUNE;Luminaire;K1034_1;;477.0;;14/11/2025;CITEOS QUIMPER;2025-11-14;;;;;non;non;non;non;non;non;non;non;non;non;non;aucune opération détectée
44909179;Validé;;Eclairage public;Tournée de nuit luminaire;QUIMPER;AVENUE DE GOURVILY;Luminaire;K1032_1;;477.0;;14/11/2025;CITEOS QUIMPER;2025-11-14;;;;;non;non;non;non;non;non;non;non;non;non;non;aucune opération détectée
44909177;Validé;;Eclairage public;Tournée de nuit luminaire;QUIMPER;AVENUE DE GOURVILY;Luminaire;K1031_1;;477.0;;14/11/2025;CITEOS QUIMPER;2025-11-14;;;;;non;non;non;non;non;non;non;non;non;non;non;aucune opération détectée
44909175;Validé;;Eclairage public;Tournée de nuit luminaire;QUIMPER;AVENUE DE GOURVILY;Luminaire;K1030_1;;477.0;;14/11/2025;CITEOS QUIMPER;2025-11-14;;;;;non;non;non;non;non;non;non;non;non;non;non;aucune opération détectée
44909173;Validé;;Eclairage public;Tournée de nuit luminaire;QUIMPER;AVENUE DE GOURVILY;Luminaire;K1029_1;;477.0;;14/11/2025;CITEOS QUIMPER;2025-11-14;;;;;non;non;non;non;non;non;non;non;non;non;non;aucune opération détectée
44909171;Validé;;Eclairage public;Tournée de nuit luminaire;QUIMPER;AVENUE DE GOURVILY;Luminaire;K1028_1;;477.0;;14/11/2025;CITEOS QUIMPER;2025-11-14;;;;;non;non;non;non;non;non;non;non;non;non;non;aucune opération détectée
44909169;Validé;;Eclairage public;Tournée de nuit luminaire;QUIMPER;BOULEVARD DU FINISTERE;Luminaire;K1087_2;;477.0;;14/11/2025;CITEOS QUIMPER;2025-11-14;;;;;non;non;non;non;non;non;non;non;non;non;non;aucune opération détectée
44909167;Validé;;Eclairage public;Tournée de nuit luminaire;QUIMPER;RUE ANNE ROBERT JACQUES TURGOT;Luminaire;K1074_2;;477.0;;14/11/2025;CITEOS QUIMPER;2025-11-14;;;;;non;non;non;non;non;non;non;non;non;non;non;aucune opération détectée
44909165;Validé;;Eclairage public;Tournée de nuit luminaire;QUIMPER;RUE ANNE ROBERT JACQUES TURGOT;Luminaire;K1073_2;;477.0;;14/11/2025;CITEOS QUIMPER;2025-11-14;;;;;non;non;non;non;non;non;non;non;non;non;non;aucune opération détectée
44909163;Validé;;Eclairage public;Tournée de nuit luminaire;QUIMPER;RUE ANNE ROBERT JACQUES TURGOT;Luminaire;K1072_2;;477.0;;14/11/2025;CITEOS QUIMPER;2025-11-14;;;;;non;non;non;non;non;non;non;non;non;non;non;aucune opération détectée
44909161;Validé;;Eclairage public;Tournée de nuit luminaire;QUIMPER;RUE ANNE ROBERT JACQUES TURGOT;Luminaire;K1071_2;;477.0;;14/11/2025;CITEOS QUIMPER;2025-11-14;;;;;non;non;non;non;non;non;non;non;non;non;non;aucune opération détectée
44909159;Validé;;Eclairage public;Tournée de nuit luminaire;QUIMPER;BOULEVARD DU FINISTERE;Luminaire;K1098_2;;477.0;;14/11/2025;CITEOS QUIMPER;2025-11-14;;;;;non;non;non;non;non;non;non;non;non;non;non;aucune opération détectée
44909157;Validé;;Eclairage public;Tournée de nuit luminaire;QUIMPER;RUE ANNE ROBERT JACQUES TURGOT;Luminaire;K1070_2;;477.0;;14/11/2025;CITEOS QUIMPER;2025-11-14;;;;;non;non;non;non;non;non;non;non;non;non;non;aucune opération détectée
44909155;Validé;;Eclairage public;Tournée de nuit luminaire;QUIMPER;RUE MARECHAL JOFFRE;Luminaire;K1104_2;;477.0;;14/11/2025;CITEOS QUIMPER;2025-11-14;;;;;non;non;non;non;non;non;non;non;non;non;non;aucune opération détectée
44909153;Validé;;Eclairage public;Tournée de nuit luminaire;QUIMPER;RUE MARECHAL JOFFRE;Luminaire;K1103_2;;477.0;;14/11/2025;CITEOS QUIMPER;2025-11-14;;;;;non;non;non;non;non;non;non;non;non;non;non;aucune opération détectée
44909151;Validé;;Eclairage public;Tournée de nuit luminaire;QUIMPER;RUE MARECHAL JOFFRE;Luminaire;K1102_2;;477.0;;14/11/2025;CITEOS QUIMPER;2025-11-14;;;;;non;non;non;non;non;non;non;non;non;non;non;aucune opération détectée
44909149;Validé;;Eclairage public;Tournée de nuit luminaire;QUIMPER;BOULEVARD DU FINISTERE;Luminaire;K1088_2;;477.0;;14/11/2025;CITEOS QUIMPER;2025-11-14;;;;;non;non;non;non;non;non;non;non;non;non;non;aucune opération détectée
44909147;Validé;;Eclairage public;Tournée de nuit luminaire;QUIMPER;BOULEVARD DU FINISTERE;Luminaire;K1086_2;;477.0;;14/11/2025;CITEOS QUIMPER;2025-11-14;;;;;non;non;non;non;non;non;non;non;non;non;non;aucune opération détectée
44909145;Validé;;Eclairage public;Tournée de nuit luminaire;QUIMPER;BOULEVARD DU FINISTERE;Luminaire;K1085_2;;477.0;;14/11/2025;CITEOS QUIMPER;2025-11-14;;;;;non;non;non;non;non;non;non;non;non;non;non;aucune opération détectée
44909143;Validé;;Eclairage public;Tournée de nuit luminaire;QUIMPER;BOULEVARD DU FINISTERE;Luminaire;K1090_2;;477.0;;14/11/2025;CITEOS QUIMPER;2025-11-14;;;;;non;non;non;non;non;non;non;non;non;non;non;aucune opération détectée
44909141;Validé;;Eclairage public;Tournée de nuit luminaire;QUIMPER;BOULEVARD DU FINISTERE;Luminaire;K1081_1;;477.0;;14/11/2025;CITEOS QUIMPER;2025-11-14;;;;;non;non;non;non;non;non;non;non;non;non;non;aucune opération détectée
44909139;Validé;;Eclairage public;Tournée de nuit luminaire;QUIMPER;BOULEVARD DU FINISTERE;Luminaire;K1082_1;;477.0;;14/11/2025;CITEOS QUIMPER;2025-11-14;;;;;non;non;non;non;non;non;non;non;non;non;non;aucune opération détectée
44909137;Validé;;Eclairage public;Tournée de nuit luminaire;QUIMPER;BOULEVARD DU FINISTERE;Luminaire;K1083_1;;477.0;;14/11/2025;CITEOS QUIMPER;2025-11-14;;;;;non;non;non;non;non;non;non;non;non;non;non;aucune opération détectée
44909135;Validé;;Eclairage public;Tournée de nuit luminaire;QUIMPER;PLACE CHARLES DE GAULLE;Luminaire;k646_2;;477.0;;14/11/2025;CITEOS QUIMPER;2025-11-14;;;;;non;non;non;non;non;non;non;non;non;non;non;aucune opération détectée
44909133;Validé;;Eclairage public;Tournée de nuit luminaire;QUIMPER;RUE MONSEIGNEUR DU MARHALLAC'H;Luminaire;K1422_1;;477.0;;14/11/2025;CITEOS QUIMPER;2025-11-14;;;;;non;non;non;non;non;non;non;non;non;non;non;aucune opération détectée
44909131;Validé;;Eclairage public;Tournée de nuit luminaire;QUIMPER;RUE EMMANUEL POULIQUEN;Luminaire;K614_1;;477.0;;14/11/2025;CITEOS QUIMPER;2025-11-14;;;;;non;non;non;non;non;non;non;non;non;non;non;aucune opération détectée
44909129;Validé;;Eclairage public;Tournée de nuit luminaire;QUIMPER;RUE EMMANUEL POULIQUEN;Luminaire;K613_1;;477.0;;14/11/2025;CITEOS QUIMPER;2025-11-14;;;;;non;non;non;non;non;non;non;non;non;non;non;aucune opération détectée
44909127;Validé;;Eclairage public;Tournée de nuit luminaire;QUIMPER;RUE FILIGER;Luminaire;K451_1;;477.0;;14/11/2025;CITEOS QUIMPER;2025-11-14;;;;;non;non;non;non;non;non;non;non;non;non;non;aucune opération détectée
44909125;Validé;;Eclairage public;Tournée de nuit luminaire;QUIMPER;RUE MONSEIGNEUR DUPARC;Luminaire;K475_1;;477.0;;14/11/2025;CITEOS QUIMPER;2025-11-14;;;;;non;non;non;non;non;non;non;non;non;non;non;aucune opération détectée
44909123;Validé;;Eclairage public;Tournée de nuit luminaire;QUIMPER;RUE CELESTIN FREINET;Luminaire;K618_1;;477.0;;14/11/2025;CITEOS QUIMPER;2025-11-14;;;;;non;non;non;non;non;non;non;non;non;non;non;aucune opération détectée
44909121;Validé;;Eclairage public;Tournée de nuit luminaire;QUIMPER;RUE EMMANUEL POULIQUEN;Luminaire;K616_1;;477.0;;14/11/2025;CITEOS QUIMPER;2025-11-14;;;;;non;non;non;non;non;non;non;non;non;non;non;aucune opération détectée
44909119;Validé;;Eclairage public;Tournée de nuit luminaire;QUIMPER;RUE EMMANUEL POULIQUEN;Luminaire;K615_1;;477.0;;14/11/2025;CITEOS QUIMPER;2025-11-14;;;;;non;non;non;non;non;non;non;non;non;non;non;aucune opération détectée
44909117;Validé;;Eclairage public;Tournée de nuit luminaire;QUIMPER;RUE CELESTIN FREINET;Luminaire;K617_1;;477.0;;14/11/2025;CITEOS QUIMPER;2025-11-14;;;;;non;non;non;non;non;non;non;non;non;non;non;aucune opération détectée
44909115;Validé;;Eclairage public;Tournée de nuit luminaire;QUIMPER;RUE DE LEURGUERIC;Luminaire;K612_1;;477.0;;14/11/2025;CITEOS QUIMPER;2025-11-14;;;;;non;non;non;non;non;non;non;non;non;non;non;aucune opération détectée
44909113;Validé;;Eclairage public;Tournée de nuit luminaire;QUIMPER;RUE DE LEURGUERIC;Luminaire;K611_1;;477.0;;14/11/2025;CITEOS QUIMPER;2025-11-14;;;;;non;non;non;non;non;non;non;non;non;non;non;aucune opération détectée
44909111;Validé;;Eclairage public;Tournée de nuit luminaire;QUIMPER;RUE DE MISSILIEN;Luminaire;K650_1;;477.0;;14/11/2025;CITEOS QUIMPER;2025-11-14;;;;;non;non;non;non;non;non;non;non;non;non;non;aucune opération détectée
44909109;Validé;;Eclairage public;Tournée de nuit luminaire;QUIMPER;RUE DE MISSILIEN;Luminaire;K651_1;;477.0;;14/11/2025;CITEOS QUIMPER;2025-11-14;;;;;non;non;non;non;non;non;non;non;non;non;non;aucune opération détectée
44909107;Validé;;Eclairage public;Tournée de nuit luminaire;QUIMPER;RUE JEAN RAMEAU;Luminaire;K1377_1;;477.0;;14/11/2025;CITEOS QUIMPER;2025-11-14;;;;;non;non;non;non;non;non;non;non;non;non;non;aucune opération détectée
44909105;Validé;;Eclairage public;Tournée de nuit luminaire;QUIMPER;RUE JEAN RAMEAU;Luminaire;K1378_1;;477.0;;14/11/2025;CITEOS QUIMPER;2025-11-14;;;;;non;non;non;non;non;non;non;non;non;non;non;aucune opération détectée
44909103;Validé;;Eclairage public;Tournée de nuit luminaire;QUIMPER;RUE JEAN RAMEAU;Luminaire;K855_1;;477.0;;14/11/2025;CITEOS QUIMPER;2025-11-14;;;;;non;non;non;non;non;non;non;non;non;non;non;aucune opération détectée
44909101;Validé;;Eclairage public;Tournée de nuit luminaire;QUIMPER;RUE JEAN RAMEAU;Luminaire;K854_1;;477.0;;14/11/2025;CITEOS QUIMPER;2025-11-14;;;;;non;non;non;non;non;non;non;non;non;non;non;aucune opération détectée
44909099;Validé;;Eclairage public;Tournée de nuit luminaire;QUIMPER;RUE DE MISSILIEN;Luminaire;K2109;;477.0;;14/11/2025;CITEOS QUIMPER;2025-11-14;;;;;non;non;non;non;non;non;non;non;non;non;non;aucune opération détectée
44909097;Validé;;Eclairage public;Tournée de nuit luminaire;QUIMPER;RUE VIRGINIE HERIOT;Luminaire;K884_2;;477.0;;14/11/2025;CITEOS QUIMPER;2025-11-14;;;;;non;non;non;non;non;non;non;non;non;non;non;aucune opération détectée
44909095;Validé;;Eclairage public;Tournée de nuit luminaire;QUIMPER;RUE VIRGINIE HERIOT;Luminaire;K883_2;;477.0;;14/11/2025;CITEOS QUIMPER;2025-11-14;;;;;non;non;non;non;non;non;non;non;non;non;non;aucune opération détectée
44909093;Validé;;Eclairage public;Tournée de nuit luminaire;QUIMPER;RUE JEAN RAMEAU;Luminaire;K822_1;;477.0;;14/11/2025;CITEOS QUIMPER;2025-11-14;;;;;non;non;non;non;non;non;non;non;non;non;non;aucune opération détectée
44909091;Validé;;Eclairage public;Tournée de nuit luminaire;QUIMPER;RUE HECTOR BERLIOZ;Luminaire;K776_1;;477.0;;14/11/2025;CITEOS QUIMPER;2025-11-14;;;;;non;non;non;non;non;non;non;non;non;non;non;aucune opération détectée
44909089;Validé;;Eclairage public;Tournée de nuit luminaire;QUIMPER;BOULEVARD DES FRERES MAILLET;Luminaire;K758_1;;477.0;;14/11/2025;CITEOS QUIMPER;2025-11-14;;;;;non;non;non;non;non;non;non;non;non;non;non;aucune opération détectée
44909087;Validé;;Eclairage public;Tournée de nuit luminaire;QUIMPER;RUE MAURICE RAVEL;Luminaire;K774_1;;477.0;;14/11/2025;CITEOS QUIMPER;2025-11-14;;;;;non;non;non;non;non;non;non;non;non;non;non;aucune opération détectée
44909085;Validé;;Eclairage public;Tournée de nuit luminaire;QUIMPER;BOULEVARD DES FRERES MAILLET;Luminaire;K756_1;;477.0;;14/11/2025;CITEOS QUIMPER;2025-11-14;;;;;non;non;non;non;non;non;non;non;non;non;non;aucune opération détectée
44909083;Validé;;Eclairage public;Tournée de nuit luminaire;QUIMPER;BOULEVARD DES FRERES MAILLET;Luminaire;K771_1;;477.0;;14/11/2025;CITEOS QUIMPER;2025-11-14;;;;;non;non;non;non;non;non;non;non;non;non;non;aucune opération détectée
44909081;Validé;;Eclairage public;Tournée de nuit luminaire;QUIMPER;BOULEVARD DES FRERES MAILLET;Luminaire;K770_1;;477.0;;14/11/2025;CITEOS QUIMPER;2025-11-14;;;;;non;non;non;non;non;non;non;non;non;non;non;aucune opération détectée
44909079;Validé;;Eclairage public;Tournée de nuit luminaire;QUIMPER;BOULEVARD DES FRERES MAILLET;Luminaire;K755_1;;477.0;;14/11/2025;CITEOS QUIMPER;2025-11-14;;;;;non;non;non;non;non;non;non;non;non;non;non;aucune opération détectée
44909077;Validé;;Eclairage public;Tournée de nuit luminaire;QUIMPER;BOULEVARD DES FRERES MAILLET;Luminaire;K754_1;;477.0;;14/11/2025;CITEOS QUIMPER;2025-11-14;;;;;non;non;non;non;non;non;non;non;non;non;non;aucune opération détectée
44909075;Validé;;Eclairage public;Tournée de nuit luminaire;QUIMPER;BOULEVARD DES FRERES MAILLET;Luminaire;K769_1;;477.0;;14/11/2025;CITEOS QUIMPER;2025-11-14;;;;;non;non;non;non;non;non;non;non;non;non;non;aucune opération détectée
44909073;Validé;;Eclairage public;Tournée de nuit luminaire;QUIMPER;RUE HECTOR BERLIOZ;Luminaire;K775_1;;477.0;;14/11/2025;CITEOS QUIMPER;2025-11-14;;;;;non;non;non;non;non;non;non;non;non;non;non;aucune opération détectée
44909071;Validé;;Eclairage public;Tournée de nuit luminaire;QUIMPER;BOULEVARD DES FRERES MAILLET;Luminaire;K768_1;;477.0;;14/11/2025;CITEOS QUIMPER;2025-11-14;;;;;non;non;non;non;non;non;non;non;non;non;non;aucune opération détectée
44909069;Validé;;Eclairage public;Tournée de nuit luminaire;QUIMPER;BOULEVARD DES FRERES MAILLET;Luminaire;K767_1;;477.0;;14/11/2025;CITEOS QUIMPER;2025-11-14;;;;;non;non;non;non;non;non;non;non;non;non;non;aucune opération détectée
44909067;Validé;;Eclairage public;Tournée de nuit luminaire;QUIMPER;BOULEVARD DES FRERES MAILLET;Luminaire;K753_1;;477.0;;14/11/2025;CITEOS QUIMPER;2025-11-14;;;;;non;non;non;non;non;non;non;non;non;non;non;aucune opération détectée
44909065;Validé;;Eclairage public;Tournée de nuit luminaire;QUIMPER;BOULEVARD DES FRERES MAILLET;Luminaire;K751_1;;477.0;;14/11/2025;CITEOS QUIMPER;2025-11-14;;;;;non;non;non;non;non;non;non;non;non;non;non;aucune opération détectée
44909063;Validé;;Eclairage public;Tournée de nuit luminaire;QUIMPER;RUE CHARLES GOUNOD;Luminaire;K1788_1;;477.0;;14/11/2025;CITEOS QUIMPER;2025-11-14;;;;;non;non;non;non;non;non;non;non;non;non;non;aucune opération détectée
44909061;Validé;;Eclairage public;Tournée de nuit luminaire;QUIMPER;RUE VINCENT D'INDY;Luminaire;K1786_1;;477.0;;14/11/2025;CITEOS QUIMPER;2025-11-14;;;;;non;non;non;non;non;non;non;non;non;non;non;aucune opération détectée
44909059;Validé;;Eclairage public;Tournée de nuit luminaire;QUIMPER;RUE JEAN RAMEAU;Luminaire;K1579_1;;477.0;;14/11/2025;CITEOS QUIMPER;2025-11-14;;;;;non;non;non;non;non;non;non;non;non;non;non;aucune opération détectée
44909057;Validé;;Eclairage public;Tournée de nuit luminaire;QUIMPER;BOULEVARD DES FRERES MAILLET;Luminaire;K772_1;;477.0;;14/11/2025;CITEOS QUIMPER;2025-11-14;;;;;non;non;non;non;non;non;non;non;non;non;non;aucune opération détectée
44909055;Validé;;Eclairage public;Tournée de nuit luminaire;QUIMPER;RUE CHARLES GOUNOD;Luminaire;K846_1;;477.0;;14/11/2025;CITEOS QUIMPER;2025-11-14;;;;;non;non;non;non;non;non;non;non;non;non;non;aucune opération détectée
44909053;Validé;;Eclairage public;Tournée de nuit luminaire;QUIMPER;RUE VINCENT D'INDY;Luminaire;K853_1;;477.0;;14/11/2025;CITEOS QUIMPER;2025-11-14;;;;;non;non;non;non;non;non;non;non;non;non;non;aucune opération détectée
44909051;Validé;;Eclairage public;Tournée de nuit luminaire;QUIMPER;RUE DE PEN AR RUN;Luminaire;K852_1;;477.0;;14/11/2025;CITEOS QUIMPER;2025-11-14;;;;;non;non;non;non;non;non;non;non;non;non;non;aucune opération détectée
44909049;Validé;;Eclairage public;Tournée de nuit luminaire;QUIMPER;RUE VINCENT D'INDY;Luminaire;K851_1;;477.0;;14/11/2025;CITEOS QUIMPER;2025-11-14;;;;;non;non;non;non;non;non;non;non;non;non;non;aucune opération détectée
44909047;Validé;;Eclairage public;Tournée de nuit luminaire;QUIMPER;RUE VINCENT D'INDY;Luminaire;K847_1;;477.0;;14/11/2025;CITEOS QUIMPER;2025-11-14;;;;;non;non;non;non;non;non;non;non;non;non;non;aucune opération détectée
44909045;Validé;;Eclairage public;Tournée de nuit luminaire;QUIMPER;RUE CHARLES GOUNOD;Luminaire;K848_1;;477.0;;14/11/2025;CITEOS QUIMPER;2025-11-14;;;;;non;non;non;non;non;non;non;non;non;non;non;aucune opération détectée
44909043;Validé;;Eclairage public;Tournée de nuit luminaire;QUIMPER;RUE CHARLES GOUNOD;Luminaire;K849_1;;477.0;;14/11/2025;CITEOS QUIMPER;2025-11-14;;;;;non;non;non;non;non;non;non;non;non;non;non;aucune opération détectée
44909041;Validé;;Eclairage public;Tournée de nuit luminaire;QUIMPER;RUE CHARLES GOUNOD;Luminaire;K850_1;;477.0;;14/11/2025;CITEOS QUIMPER;2025-11-14;;;;;non;non;non;non;non;non;non;non;non;non;non;aucune opération détectée
44909039;Validé;;Eclairage public;Tournée de nuit luminaire;QUIMPER;BOULEVARD DES FRERES MAILLET;Luminaire;K757_1;;477.0;;14/11/2025;CITEOS QUIMPER;2025-11-14;;;;;non;non;non;non;non;non;non;non;non;non;non;aucune opération détectée
